{
  "document_metadata": {
    "page_number": "44",
    "document_number": "DOJ-OGR-00015841",
    "date": "1966",
    "document_type": "Pilot's Logbook Page",
    "has_handwriting": true,
    "has_stamps": false
  },
  "full_text": "Date Aircraft Make and Model Aircraft Identification Mark Points of Departure & Arrival Miles Flown Flight No. Remarks, Procedures, Maneuvers, Endorsements Number of Landings Aircraft Category... 1966 G1159B N908JE From To 26 TEB CMH 846 1 2 26 CMH PBI 897 1 1 26 PBI TEB 908 2 4 10 TEB PBI 902 2 5 14 PBI TEB 903 2 4 15 TEB CMH 904 1 2 15 CMH TEB 905 1 2 19 TEB PBI 906 2 3 22 PBI TEB 907 2 3 24 TEB SAF 908 4 1 25 SAF PBI 909 3 2 27 PBI TEB 910 2 4 30 TEB DCA 911 1 30 DCA TEB 912 1 31 TEB PBI 913 2 2 Nov 1 PBI TEB 914 2 5 7 TEB PBI 915 2 2 11 PBI TEB 916 2 2 15 TEB CMH 917 1 3 I certify that the statements made by me on this form are true. Pilot's Signature David Rodgers Page Total 119 387 Amount Forward 5575 6768 7 Total to Date 5886 680 74",
  "text_blocks": [
    {
      "type": "printed",
      "content": "Date Aircraft Make and Model Aircraft Identification Mark Points of Departure & Arrival Miles Flown Flight No. Remarks, Procedures, Maneuvers, Endorsements Number of Landings Aircraft Category...",
      "position": "header"
    },
    {
      "type": "handwritten",
      "content": "1966",
      "position": "body"
    },
    {
      "type": "printed",
      "content": "I certify that the statements made by me on this form are true.",
      "position": "footer"
    },
    {
      "type": "signature",
      "content": "David Rodgers",
      "position": "footer"
    }
  ],
  "entities": {
    "people": [
      "David Rodgers"
    ],
    "organizations": [],
    "locations": [
      "TEB",
      "CMH",
      "PBI",
      "SAF",
      "DCA"
    ],
    "dates": [
      "1966",
      "Nov 1"
    ],
    "reference_numbers": [
      "G1159B",
      "N908JE",
      "DOJ-OGR-00015841"
    ]
  },
  "additional_notes": "The document is a pilot's logbook page with handwritten entries and a signature. The page is numbered 44 and has a document number DOJ-OGR-00015841."
}