{
  "document_metadata": {
    "page_number": "38",
    "document_number": "DOJ-OGR-00015835",
    "date": null,
    "document_type": "Pilot's Logbook Page",
    "has_handwriting": true,
    "has_stamps": false
  },
  "full_text": "Date Aircraft Make and Model Aircraft Identification Mark Points of Departure & Arrival Miles Flown Flight No. Remarks, Procedures, Maneuvers, Endorsements Number of Landings Aircraft Category 1995 SEP 21 G11598 N908DE CMH TEB 760 761 1 2 AIRPLANE 21 \" N908DE TEB PBI 761 2 2 \" 25 \" PBI TEB 762 1 2 \" 28 \" TEB PBI 763 2 2 \" 29 \" PBI TEB 764 2 2 \" 6 \" TEB PBI 765 2 2 \" 9 \" PBI TEB 766 1 2 3 \" 9 \" TEB PBI 767 2 2 \" 22 \" PBI TEB 768 2 2 \" 24 \" TEB PBI 769 2 2 \" 29 \" PBI TEB 770 2 3 \" 31 \" TEB SAF 771 4 5 NOV 1 \" SAF PBI 772 3 3 5 \" PBI TEB 773 2 5 9 \" TEB PBE 774 2 2 13 \" PBE DCA 775 1 9 13 \" DCA TEB 776 1 7 16 \" TEB DAY 777 1 3 17 \" DAY CMH 778 1 1 3 I certify that the statements made by me on this form are true. Pilot's Signature David Hodge Page Total 41 295 Amount Forward 5319 65191 Total to Date 5825 65586",
  "text_blocks": [
    {
      "type": "printed",
      "content": "Date Aircraft Make and Model Aircraft Identification Mark Points of Departure & Arrival Miles Flown Flight No. Remarks, Procedures, Maneuvers, Endorsements Number of Landings Aircraft Category",
      "position": "header"
    },
    {
      "type": "handwritten",
      "content": "1995 SEP 21 G11598 N908DE CMH TEB 760 761 1 2 AIRPLANE 21 \" N908DE TEB PBI 761 2 2 \" 25 \" PBI TEB 762 1 2 \" 28 \" TEB PBI 763 2 2 \" 29 \" PBI TEB 764 2 2 \" 6 \" TEB PBI 765 2 2 \" 9 \" PBI TEB 766 1 2 3 \" 9 \" TEB PBI 767 2 2 \" 22 \" PBI TEB 768 2 2 \" 24 \" TEB PBI 769 2 2 \" 29 \" PBI TEB 770 2 3 \" 31 \" TEB SAF 771 4 5 NOV 1 \" SAF PBI 772 3 3 5 \" PBI TEB 773 2 5 9 \" TEB PBE 774 2 2 13 \" PBE DCA 775 1 9 13 \" DCA TEB 776 1 7 16 \" TEB DAY 777 1 3 17 \" DAY CMH 778 1 1 3",
      "position": "body"
    },
    {
      "type": "printed",
      "content": "I certify that the statements made by me on this form are true.",
      "position": "footer"
    },
    {
      "type": "handwritten",
      "content": "David Hodge",
      "position": "footer"
    },
    {
      "type": "printed",
      "content": "Page Total Amount Forward Total to Date",
      "position": "footer"
    },
    {
      "type": "handwritten",
      "content": "41 295 5319 65191 5825 65586",
      "position": "footer"
    }
  ],
  "entities": {
    "people": [
      "David Hodge"
    ],
    "organizations": [],
    "locations": [
      "CMH",
      "TEB",
      "PBI",
      "SAF",
      "PBE",
      "DCA",
      "DAY"
    ],
    "dates": [
      "1995 SEP 21",
      "1995 SEP 25",
      "1995 SEP 28",
      "1995 SEP 29",
      "1995 SEP 6",
      "1995 SEP 9",
      "1995 SEP 22",
      "1995 SEP 24",
      "1995 SEP 29",
      "1995 SEP 31",
      "1995 NOV 1",
      "1995 NOV 5",
      "1995 NOV 9",
      "1995 NOV 13",
      "1995 NOV 16",
      "1995 NOV 17"
    ],
    "reference_numbers": [
      "G11598",
      "N908DE",
      "760",
      "761",
      "762",
      "763",
      "764",
      "765",
      "766",
      "767",
      "768",
      "769",
      "770",
      "771",
      "772",
      "773",
      "774",
      "775",
      "776",
      "777",
      "778",
      "41",
      "295",
      "5319",
      "65191",
      "5825",
      "65586"
    ]
  },
  "additional_notes": "The document is a pilot's logbook page with handwritten entries. The page is filled with flight records, including dates, aircraft information, flight details, and landings. The pilot has signed the page at the bottom."
}