{
  "document_metadata": {
    "page_number": "133",
    "document_number": "763",
    "date": "08/10/22",
    "document_type": "court transcript",
    "has_handwriting": false,
    "has_stamps": false
  },
  "full_text": "Case 1:20-cr-00330-AJN Document 763 Filed 08/10/22 Page 133 of 197 2674 LCHVMAX4 Healy - direct 1 A. I was working at Pete's Tavern. 2 Q. And I think you said your sister was working at J. Epstein; 3 is that right? 4 A. Yes, she was a receptionist. 5 Q. And at some point did someone ask you to come fill in? Do 6 you know who that was? 7 A. I can't recall that. 8 Q. Okay. But your sister was working there before you? 9 A. Yes. 10 Q. And when you came to fill in, what job did you do when you 11 came to fill in at J. Epstein and Company? 12 A. Just errands. 13 Q. And where was J. Epstein and Company? 14 A. 457 Madison Avenue. 15 Q. How long did you end up working at J. Epstein and Company? 16 A. I think I was there from 1996 until about 1999. 17 Q. And where did you go in 1999? 18 A. I went to New Mexico. 19 Q. So just focusing on that period of time, 1996 to 1999, 20 while you were working at J. Epstein and Company, did you meet 21 Jeffrey Epstein? 22 A. Yes. 23 Q. How did you meet him? 24 A. He was my boss. 25 Q. And what were your roles and responsibilities during that SOUTHERN DISTRICT REPORTERS, P.C. (212) 805-0300 DOJ-OGR-00016862",
  "text_blocks": [
    {
      "type": "printed",
      "content": "Case 1:20-cr-00330-AJN Document 763 Filed 08/10/22 Page 133 of 197 2674 LCHVMAX4 Healy - direct",
      "position": "header"
    },
    {
      "type": "printed",
      "content": "1 A. I was working at Pete's Tavern. 2 Q. And I think you said your sister was working at J. Epstein; 3 is that right? 4 A. Yes, she was a receptionist. 5 Q. And at some point did someone ask you to come fill in? Do 6 you know who that was? 7 A. I can't recall that. 8 Q. Okay. But your sister was working there before you? 9 A. Yes. 10 Q. And when you came to fill in, what job did you do when you 11 came to fill in at J. Epstein and Company? 12 A. Just errands. 13 Q. And where was J. Epstein and Company? 14 A. 457 Madison Avenue. 15 Q. How long did you end up working at J. Epstein and Company? 16 A. I think I was there from 1996 until about 1999. 17 Q. And where did you go in 1999? 18 A. I went to New Mexico. 19 Q. So just focusing on that period of time, 1996 to 1999, 20 while you were working at J. Epstein and Company, did you meet 21 Jeffrey Epstein? 22 A. Yes. 23 Q. How did you meet him? 24 A. He was my boss. 25 Q. And what were your roles and responsibilities during that",
      "position": "main"
    },
    {
      "type": "printed",
      "content": "SOUTHERN DISTRICT REPORTERS, P.C. (212) 805-0300",
      "position": "footer"
    },
    {
      "type": "printed",
      "content": "DOJ-OGR-00016862",
      "position": "footer"
    }
  ],
  "entities": {
    "people": [
      "Jeffrey Epstein"
    ],
    "organizations": [
      "J. Epstein and Company",
      "SOUTHERN DISTRICT REPORTERS, P.C.",
      "Pete's Tavern"
    ],
    "locations": [
      "New Mexico",
      "457 Madison Avenue"
    ],
    "dates": [
      "08/10/22",
      "1996",
      "1999"
    ],
    "reference_numbers": [
      "1:20-cr-00330-AJN",
      "763",
      "DOJ-OGR-00016862"
    ]
  },
  "additional_notes": "The document appears to be a court transcript with a clear Q&A format. The content is related to a case involving Jeffrey Epstein. The document is well-formatted and legible."
}