{
  "document_metadata": {
    "page_number": "156",
    "document_number": "782",
    "date": "01/15/25",
    "document_type": "court transcript",
    "has_handwriting": false,
    "has_stamps": false
  },
  "full_text": "Case 1:20-cr-00330-PAE Document 782 Filed 01/15/25 Page 156 of 158 156 LBAAMAX5ps\n\n1 identified, because we can't randomly assign individuals to be\n2 sexually abused or not. So we have to look at other measures\n3 of testability and scientific ways to study these issues, as\n4 well as acceptance within the commun -- general and\n5 professional community.\n6 Q. And finally, what is the study that you're relying on to\n7 determine that this theory of grooming has gained general\n8 acceptance in the scientific community?\n9 A. As I've said, none of my opinions are based on any single\n10 study, alone.\n11 MR. PAGLIUCA: That's all I have, your Honor. Thank\n12 you.\n13 THE COURT: OK. Thank you.\n14 Anything, Ms. Pomerantz?\n15 MS. POMERANTZ: Your Honor, may we have a moment?\n16 THE COURT: You may.\n17 (Counsel confer)\n18 MS. POMERANTZ: Nothing from the government, your\n19 Honor.\n20 THE COURT: All right. Thank you.\n21 Dr. Rocchio, thank you very much. You're excused.\n22 THE WITNESS: Thank you, your Honor.\n23 (Witness excused)\n24 THE COURT: I just, I have a couple of questions for\n25 the defense. Does the defense intend to impeach witness\n\nSOUTHERN DISTRICT REPORTERS, P.C.\n(212) 805-0300",
  "text_blocks": [
    {
      "type": "printed",
      "content": "Case 1:20-cr-00330-PAE Document 782 Filed 01/15/25 Page 156 of 158 156 LBAAMAX5ps",
      "position": "header"
    },
    {
      "type": "printed",
      "content": "1 identified, because we can't randomly assign individuals to be\n2 sexually abused or not. So we have to look at other measures\n3 of testability and scientific ways to study these issues, as\n4 well as acceptance within the commun -- general and\n5 professional community.\n6 Q. And finally, what is the study that you're relying on to\n7 determine that this theory of grooming has gained general\n8 acceptance in the scientific community?\n9 A. As I've said, none of my opinions are based on any single\n10 study, alone.\n11 MR. PAGLIUCA: That's all I have, your Honor. Thank\n12 you.\n13 THE COURT: OK. Thank you.\n14 Anything, Ms. Pomerantz?\n15 MS. POMERANTZ: Your Honor, may we have a moment?\n16 THE COURT: You may.\n17 (Counsel confer)\n18 MS. POMERANTZ: Nothing from the government, your\n19 Honor.\n20 THE COURT: All right. Thank you.\n21 Dr. Rocchio, thank you very much. You're excused.\n22 THE WITNESS: Thank you, your Honor.\n23 (Witness excused)\n24 THE COURT: I just, I have a couple of questions for\n25 the defense. Does the defense intend to impeach witness",
      "position": "main content"
    },
    {
      "type": "printed",
      "content": "SOUTHERN DISTRICT REPORTERS, P.C.\n(212) 805-0300",
      "position": "footer"
    }
  ],
  "entities": {
    "people": [
      "MR. PAGLIUCA",
      "MS. POMERANTZ",
      "Dr. Rocchio"
    ],
    "organizations": [
      "SOUTHERN DISTRICT REPORTERS, P.C."
    ],
    "locations": [],
    "dates": [
      "01/15/25"
    ],
    "reference_numbers": [
      "1:20-cr-00330-PAE",
      "782"
    ]
  },
  "additional_notes": "The document appears to be a court transcript with a clear and legible format. There are no visible redactions or damage."
}