{
  "document_metadata": {
    "page_number": "112",
    "document_number": "DOJ-OGR-00015909",
    "date": "2004",
    "document_type": "Pilot's Flight Log",
    "has_handwriting": true,
    "has_stamps": false
  },
  "full_text": "Date Aircraft Make and Model Aircraft Identification Mark Points of Departure & Arrival Miles Flown Flight No. Remarks, Procedures, Maneuvers, Endorsements Number of Landings Aircraft Category... Airplane Glider Helicopter 2004 16 B-727-31H N908JE TIST PBI 300 1 24 17 PBI JFK 381 1 25 20 JFK LFPB 382 25 LFPB JFK 383 25 JFK JAX 384 1 21 29 G-1159B N909JE PBI TEB 173 1 26 29 TEB PBI 173 1 23 29 PBI TIST 173 1 26 1 BHT-467 N491GM TIST LSS 1 BHT-467 N491GM LSS TIST 2 G-1159B N909JE TIST TEB 173 1 40 7 G-1159B SIMULATOR DFW DFW 1 40 8 G-1159B N909JE TIST TEB 173 1 40 9 PBI TEB 173 1 27 10 TEB PBI 173 1 24 14 PBI ABY 173 1 13 14 ABY TEB 173 1 21 16 TEB BED 173 1 8 16 BED TEB 173 1 8 Page Total 413 510 Amount Forward 6783 95874 33 127 2 Total to Date 6787 96384 33 128 1 I certify that the statements made by me on this form are true. Pilot's Signature David Redding",
  "text_blocks": [
    {
      "type": "printed",
      "content": "Date Aircraft Make and Model Aircraft Identification Mark Points of Departure & Arrival Miles Flown Flight No. Remarks, Procedures, Maneuvers, Endorsements Number of Landings Aircraft Category... Airplane Glider Helicopter",
      "position": "header"
    },
    {
      "type": "handwritten",
      "content": "2004 16 B-727-31H N908JE TIST PBI 300 1 24 17 PBI JFK 381 1 25 20 JFK LFPB 382 25 LFPB JFK 383 25 JFK JAX 384 1 21 29 G-1159B N909JE PBI TEB 173 1 26 29 TEB PBI 173 1 23 29 PBI TIST 173 1 26 1 BHT-467 N491GM TIST LSS 1 BHT-467 N491GM LSS TIST 2 G-1159B N909JE TIST TEB 173 1 40 7 G-1159B SIMULATOR DFW DFW 1 40 8 G-1159B N909JE TIST TEB 173 1 40 9 PBI TEB 173 1 27 10 TEB PBI 173 1 24 14 PBI ABY 173 1 13 14 ABY TEB 173 1 21 16 TEB BED 173 1 8 16 BED TEB 173 1 8",
      "position": "body"
    },
    {
      "type": "printed",
      "content": "Page Total Amount Forward Total to Date",
      "position": "footer"
    },
    {
      "type": "handwritten",
      "content": "413 510 6783 95874 33 127 2 6787 96384 33 128 1",
      "position": "footer"
    },
    {
      "type": "handwritten",
      "content": "I certify that the statements made by me on this form are true. Pilot's Signature David Redding",
      "position": "footer"
    }
  ],
  "entities": {
    "people": [
      "David Redding"
    ],
    "organizations": [],
    "locations": [
      "TIST",
      "PBI",
      "JFK",
      "LFPB",
      "JAX",
      "TEB",
      "LSS",
      "DFW",
      "ABY",
      "BED"
    ],
    "dates": [
      "2004"
    ],
    "reference_numbers": [
      "DOJ-OGR-00015909",
      "N908JE",
      "N909JE",
      "N491GM"
    ]
  },
  "additional_notes": "The document is a pilot's flight log with handwritten entries. The log includes details such as date, aircraft make and model, points of departure and arrival, miles flown, and number of landings. The document is signed by the pilot, David Redding."
}