{
  "document_metadata": {
    "page_number": "79",
    "document_number": "DOJ-OGR-00015876",
    "date": "2001",
    "document_type": "Pilot's Logbook Page",
    "has_handwriting": true,
    "has_stamps": false
  },
  "full_text": "Date Aircraft Make and Model Aircraft Identification Mark Points of Departure & Arrival Miles Flown Flight No. Remarks, Procedures, Maneuvers, Endorsements Number of Landings Aircraft Category... Jan 16 G-1159B N908JE PBI LCQ 1437 1/1 8 Jan 16 \" LCQ TEB 1439 1/1 21 Jan 17 \" TEB PBI 1439 1/1 24 Jan 22 \" PBI TEB 1440 1/1 25 Jan 23 \" TEB LFPB 1441 1/1 67 Jan 25 \" LFPB CYQX 1442 1/1 59 Jan 25 \" CYQX TEB 1445 1/1 27 Jan 26 \" TEB PBI 1444 1/1 24 Jan 18 C172 N144WV PBI LNA PBI LNA 2/2 4 Jan 18 \" LNA LCQ 1/1 24 Jan 19 \" LCQ MCO 1/1 20 Jan 19 \" MCO LNA 1/1 19 Jan 29 G-1159B N908JE PBI TIST 1445 1/1 24 Jan 30 \" TIST PBI 1446 1/1 26 Feb 3 C-421B N908GM SAF DFW 1/1 30 Jan 17 B-727-200 SIMULATOR MGM MGM 25 Jan 18 \" \" \" 30 Jan 19 \" DFW N.GM 32 Jan 20 \" MGM MGM 35 I certify that the statements made by me on this form are true. Pilot's Signature David R. Ridgway Page Total 10 9 524 Amount Forward 6351 6034 803714 33112 Total to Date 6361 6643 80898 33112",
  "text_blocks": [
    {
      "type": "printed",
      "content": "Date Aircraft Make and Model Aircraft Identification Mark Points of Departure & Arrival Miles Flown Flight No. Remarks, Procedures, Maneuvers, Endorsements Number of Landings Aircraft Category...",
      "position": "header"
    },
    {
      "type": "handwritten",
      "content": "Jan 16 G-1159B N908JE PBI LCQ 1437 1/1 8",
      "position": "body"
    },
    {
      "type": "handwritten",
      "content": "David R. Ridgway",
      "position": "footer"
    }
  ],
  "entities": {
    "people": [
      "David R. Ridgway"
    ],
    "organizations": [],
    "locations": [
      "PBI",
      "LCQ",
      "TEB",
      "LFPB",
      "CYQX",
      "LNA",
      "MCO",
      "TIST",
      "SAF",
      "DFW",
      "MGM",
      "N.GM"
    ],
    "dates": [
      "Jan 16",
      "Jan 17",
      "Jan 22",
      "Jan 23",
      "Jan 25",
      "Jan 26",
      "Jan 18",
      "Jan 19",
      "Jan 29",
      "Jan 30",
      "Feb 3"
    ],
    "reference_numbers": [
      "N908JE",
      "N144WV",
      "N908GM",
      "G-1159B",
      "C172",
      "C-421B",
      "B-727-200",
      "DOJ-OGR-00015876"
    ]
  },
  "additional_notes": "The document is a photocopy of a pilot's logbook page with handwritten entries. The page is dated 2001 and contains flight records for various aircraft. The document has been partially redacted, but the redaction does not obscure any critical information."
}