{
  "document_metadata": {
    "page_number": "125",
    "document_number": "DOJ-OGR-00024733",
    "date": "7/24/2019",
    "document_type": "Email",
    "has_handwriting": false,
    "has_stamps": false
  },
  "full_text": "Page 125 Inmate Epstein #76318-054 was removed from Suicide Watch and stepped down to Psychological Observation. He was just escorted to Health Services for a follow-up assessment/evaluation. Once completed, he will be escorted to Attorney Conference to meet with his Attorney. I will provide you with information concerning the medical assessment, once I receive it. Thanks. Shirley Skipper-Scott Associate Warden MCC New York 150 Park Row New York, New York 10007 Office: 646-836-XXX Black Berry: 646-423-XXX @bop.gov >>> Ray Ormond 7/24/2019 8:45 AM >>> Shirley - Please provide me with a daily update on this inmate, including his status and any changes/activities I should be aware of. Thanks! J. Ray Ormond Regional Director Northeast Region 215-521-XXX Page 345 DOJ-OGR-00024733",
  "text_blocks": [
    {
      "type": "printed",
      "content": "Inmate Epstein #76318-054 was removed from Suicide Watch and stepped down to Psychological Observation. He was just escorted to Health Services for a follow-up assessment/evaluation. Once completed, he will be escorted to Attorney Conference to meet with his Attorney. I will provide you with information concerning the medical assessment, once I receive it. Thanks.",
      "position": "top"
    },
    {
      "type": "printed",
      "content": "Shirley Skipper-Scott Associate Warden MCC New York 150 Park Row New York, New York 10007 Office: 646-836-XXX Black Berry: 646-423-XXX @bop.gov",
      "position": "middle"
    },
    {
      "type": "printed",
      "content": ">>> Ray Ormond 7/24/2019 8:45 AM >>> Shirley - Please provide me with a daily update on this inmate, including his status and any changes/activities I should be aware of. Thanks!",
      "position": "middle"
    },
    {
      "type": "printed",
      "content": "J. Ray Ormond Regional Director Northeast Region 215-521-XXX",
      "position": "middle"
    },
    {
      "type": "printed",
      "content": "Page 345 DOJ-OGR-00024733",
      "position": "footer"
    }
  ],
  "entities": {
    "people": [
      "Epstein",
      "Shirley Skipper-Scott",
      "Ray Ormond",
      "J. Ray Ormond"
    ],
    "organizations": [
      "MCC New York",
      "BOP"
    ],
    "locations": [
      "New York"
    ],
    "dates": [
      "7/24/2019"
    ],
    "reference_numbers": [
      "76318-054",
      "DOJ-OGR-00024733"
    ]
  },
  "additional_notes": "The document appears to be an email chain discussing the status of inmate Epstein. Some phone numbers are redacted."
}