{
  "document_metadata": {
    "page_number": "490",
    "document_number": "DOJ-OGR-00024949",
    "date": "null",
    "document_type": "null",
    "has_handwriting": false,
    "has_stamps": false
  },
  "full_text": "Page 490 reviewed the consult and recommendation from the Psychology Services Branch, Central Office that Mr. Epstein be housed with another inmate who had also been accused of committing a sex offense. There is no evidence this information was considered beyond this e-mail, and Mr. Epstein was never housed with another inmate charged or convicted of a sexual offense. (b)(5) 4. Documentation Accuracy: (b)(7)(A) (b)(7)(A) It is critical that all descriptions of the incident accurately reflect objective evidence. (b)(7)(A) (b)(7)(A) Although the incident report was later expunged, inmates frequently experience significant stress when they contemplate the potential consequences associated with findings of guilt. (b)(6); (b)(7)(C) entered a Psychology Services Intake Screening into PDS-BEMR on July 8, 2010. The document has three typographical errors. She selected the No Sexual Offense Convictions check box when, in fact, Mr. Epstein was previously convicted of Solicitation of Prostitution and Procuring a Person Under the Age of 18 for Prostitution. Second, Mr. Epstein was erroneously identified as a Black male in this document. Finally, there is one instance where he was mistakenly referred to as (b)(6); (b)(7(C) 8 DOJ-OGR-00024949",
  "text_blocks": [
    {
      "type": "printed",
      "content": "reviewed the consult and recommendation from the Psychology Services Branch, Central Office that Mr. Epstein be housed with another inmate who had also been accused of committing a sex offense. There is no evidence this information was considered beyond this e-mail, and Mr. Epstein was never housed with another inmate charged or convicted of a sexual offense.",
      "position": "top"
    },
    {
      "type": "other",
      "content": "(b)(5)",
      "position": "middle"
    },
    {
      "type": "printed",
      "content": "4. Documentation Accuracy:",
      "position": "middle"
    },
    {
      "type": "other",
      "content": "(b)(7)(A)",
      "position": "middle"
    },
    {
      "type": "printed",
      "content": "It is critical that all descriptions of the incident accurately reflect objective evidence.",
      "position": "middle"
    },
    {
      "type": "other",
      "content": "(b)(7)(A) (b)(7)(A)",
      "position": "middle"
    },
    {
      "type": "printed",
      "content": "Although the incident report was later expunged, inmates frequently experience significant stress when they contemplate the potential consequences associated with findings of guilt.",
      "position": "middle"
    },
    {
      "type": "other",
      "content": "(b)(6); (b)(7)(C)",
      "position": "middle"
    },
    {
      "type": "printed",
      "content": "entered a Psychology Services Intake Screening into PDS-BEMR on July 8, 2010. The document has three typographical errors. She selected the No Sexual Offense Convictions check box when, in fact, Mr. Epstein was previously convicted of Solicitation of Prostitution and Procuring a Person Under the Age of 18 for Prostitution. Second, Mr. Epstein was erroneously identified as a Black male in this document. Finally, there is one instance where he was mistakenly referred to as",
      "position": "middle"
    },
    {
      "type": "other",
      "content": "(b)(6); (b)(7(C)",
      "position": "middle"
    },
    {
      "type": "printed",
      "content": "8",
      "position": "bottom"
    },
    {
      "type": "printed",
      "content": "DOJ-OGR-00024949",
      "position": "footer"
    }
  ],
  "entities": {
    "people": [
      "Mr. Epstein"
    ],
    "organizations": [
      "Psychology Services Branch",
      "Central Office",
      "PDS-BEMR"
    ],
    "locations": [],
    "dates": [
      "July 8, 2010"
    ],
    "reference_numbers": [
      "DOJ-OGR-00024949"
    ]
  },
  "additional_notes": "The document appears to be a redacted report discussing the case of Mr. Epstein, with several sections blacked out for privacy or security reasons."
}