{
  "document_metadata": {
    "page_number": "296",
    "document_number": "DOJ-OGR-00024834",
    "date": null,
    "document_type": "Report or Investigation Document",
    "has_handwriting": false,
    "has_stamps": false
  },
  "full_text": "Page 296\n\nDOCUMENTS EXAMINED\n\nTRU-INTEL Download Report of Incident (583), 586, & (b)(7)(E)\nTRUVIEW - Money Exchanged; Phone, Email, & Visitor Lists; Calls; Messages; Visits; Timeline\nTRU-SCOPE - Logs, High Risk Inmates, Inmates Lists, etc.\nStaff Memorandums\nStaff E-Mail\nPhotographs of Scene; Deceased, Autopsy\nVideo Showing Scene and Staff Response\nSentry Documentation\nSIS Case File Index\nPsychology File PDS-BEMR\nPsychological Observation Procedural Memorandum\nPost Orders\nLieutenant Logs\nAttorney Logs\nStaff Roster\nMedical Information/Records (BEMR)\nBOP Twenty-Four Hour Death Report\nPre-Sentence Report\nNote(s) Left Behind by Deceased\nTime Line\nAutopsy Request & Report\nInmate Central File\nCourt Return Screening Form\nPrisoner Remand Form (If applicable)\nUSM 129 Individual Custody/Detention Report (If applicable)\nPrisoner Custody Alert Notice\nStaff Sign-In Log 1 Week Prior to Suicide (If applicable)\nDetention Orders (If applicable)\n30 minute SHU rounds\nBP 292's & 295's\n\n15\n\nDOJ-OGR-00024834",
  "text_blocks": [
    {
      "type": "printed",
      "content": "DOCUMENTS EXAMINED",
      "position": "header"
    },
    {
      "type": "printed",
      "content": "TRU-INTEL Download Report of Incident (583), 586, & (b)(7)(E)\nTRUVIEW - Money Exchanged; Phone, Email, & Visitor Lists; Calls; Messages; Visits; Timeline\nTRU-SCOPE - Logs, High Risk Inmates, Inmates Lists, etc.\nStaff Memorandums\nStaff E-Mail\nPhotographs of Scene; Deceased, Autopsy\nVideo Showing Scene and Staff Response\nSentry Documentation\nSIS Case File Index\nPsychology File PDS-BEMR\nPsychological Observation Procedural Memorandum\nPost Orders\nLieutenant Logs\nAttorney Logs\nStaff Roster\nMedical Information/Records (BEMR)\nBOP Twenty-Four Hour Death Report\nPre-Sentence Report\nNote(s) Left Behind by Deceased\nTime Line\nAutopsy Request & Report\nInmate Central File\nCourt Return Screening Form\nPrisoner Remand Form (If applicable)\nUSM 129 Individual Custody/Detention Report (If applicable)\nPrisoner Custody Alert Notice\nStaff Sign-In Log 1 Week Prior to Suicide (If applicable)\nDetention Orders (If applicable)\n30 minute SHU rounds\nBP 292's & 295's",
      "position": "main content"
    },
    {
      "type": "printed",
      "content": "15",
      "position": "footer"
    },
    {
      "type": "printed",
      "content": "DOJ-OGR-00024834",
      "position": "footer"
    }
  ],
  "entities": {
    "people": [],
    "organizations": [
      "BOP",
      "SIS",
      "USM"
    ],
    "locations": [],
    "dates": [],
    "reference_numbers": [
      "583",
      "586",
      "(b)(7)(E)",
      "DOJ-OGR-00024834",
      "BP 292",
      "BP 295",
      "USM 129"
    ]
  },
  "additional_notes": "The document appears to be a page from a report or investigation document related to a prison or correctional facility. It lists various documents examined during the investigation. The page is clean and well-formatted, with clear headings and content."
}