{
  "document_metadata": {
    "page_number": "8",
    "document_number": "715",
    "date": "07/12/22",
    "document_type": "court document",
    "has_handwriting": false,
    "has_stamps": false
  },
  "full_text": "Case 1:20-cr-00330-PAE Document 715 Filed 07/12/22 Page 8 of 8\nThe Honorable Alison J. Nathan\nDecember 6, 2021\nPage 8\nCONCLUSION\nThis Court should restrict Examiner Flatley's testimony to the fact-based narrative originally disclosed in the September 15 letter and preclude him from testifying to any expert opinions first disclosed in the November 26 letter or the December 3 or 5 emails.\nRespectfully submitted,\nJeffrey S. Pagliuca\nLaura A. Menninger\nHADDON, MORGAN & FOREMAN P.C.\n150 East 10th Avenue\nDenver, CO 80203\nPhone: 303-831-7364\nChristian R. Everdell\nCOHEN & GRESSER LLP\n800 Third Avenue\nNew York, NY 10022\nPhone: 212-957-7600\nBobbi C. Sternheim\nLaw Offices of Bobbi C. Sternheim\n225 Broadway, Suite 715\nNew York, NY 10007\nPhone: 212-243-1100\nAttorneys for Ghislaine Maxwell\ncc: Counsel of record (via email)\nDOJ-OGR-00011318",
  "text_blocks": [
    {
      "type": "printed",
      "content": "Case 1:20-cr-00330-PAE Document 715 Filed 07/12/22 Page 8 of 8",
      "position": "header"
    },
    {
      "type": "printed",
      "content": "The Honorable Alison J. Nathan\nDecember 6, 2021\nPage 8",
      "position": "header"
    },
    {
      "type": "printed",
      "content": "CONCLUSION",
      "position": "top"
    },
    {
      "type": "printed",
      "content": "This Court should restrict Examiner Flatley's testimony to the fact-based narrative originally disclosed in the September 15 letter and preclude him from testifying to any expert opinions first disclosed in the November 26 letter or the December 3 or 5 emails.",
      "position": "middle"
    },
    {
      "type": "printed",
      "content": "Respectfully submitted,",
      "position": "middle"
    },
    {
      "type": "signature",
      "content": "",
      "position": "middle"
    },
    {
      "type": "printed",
      "content": "Jeffrey S. Pagliuca\nLaura A. Menninger\nHADDON, MORGAN & FOREMAN P.C.\n150 East 10th Avenue\nDenver, CO 80203\nPhone: 303-831-7364\nChristian R. Everdell\nCOHEN & GRESSER LLP\n800 Third Avenue\nNew York, NY 10022\nPhone: 212-957-7600\nBobbi C. Sternheim\nLaw Offices of Bobbi C. Sternheim\n225 Broadway, Suite 715\nNew York, NY 10007\nPhone: 212-243-1100",
      "position": "middle"
    },
    {
      "type": "printed",
      "content": "Attorneys for Ghislaine Maxwell",
      "position": "middle"
    },
    {
      "type": "printed",
      "content": "cc: Counsel of record (via email)",
      "position": "middle"
    },
    {
      "type": "printed",
      "content": "DOJ-OGR-00011318",
      "position": "footer"
    }
  ],
  "entities": {
    "people": [
      "Alison J. Nathan",
      "Examiner Flatley",
      "Jeffrey S. Pagliuca",
      "Laura A. Menninger",
      "Christian R. Everdell",
      "Bobbi C. Sternheim",
      "Ghislaine Maxwell"
    ],
    "organizations": [
      "HADDON, MORGAN & FOREMAN P.C.",
      "COHEN & GRESSER LLP",
      "Law Offices of Bobbi C. Sternheim"
    ],
    "locations": [
      "Denver, CO",
      "New York, NY"
    ],
    "dates": [
      "December 6, 2021",
      "September 15",
      "November 26",
      "December 3",
      "December 5",
      "07/12/22"
    ],
    "reference_numbers": [
      "1:20-cr-00330-PAE",
      "715",
      "DOJ-OGR-00011318"
    ]
  },
  "additional_notes": "The document appears to be a court filing with a clear and legible format. There are no visible redactions or damage."
}