{
  "document_metadata": {
    "page_number": "314",
    "document_number": "A-5771",
    "date": null,
    "document_type": "transcript or deposition",
    "has_handwriting": false,
    "has_stamps": false
  },
  "full_text": "C2grdau2 Brune - redirect 314\n1 Q. Further down, under \"Addresses\" it has a Bronxville\n2 address, correct?\n3 A. At the top it has the Bronx address. Then there are a\n4 whole bunch of other addresses, including the Bronxville\n5 address.\n6 Q. If you turn the page, there are listings of various\n7 lawsuits, correct?\n8 A. I am now on page 2, and you're right, there are some\n9 lawsuits listed there.\n10 Q. Including one that relates or has listed a Bronxville\n11 address, correct, under New York docket judgment at the bottom\n12 there on page 2?\n13 A. Yes.\n14 Q. If you turn to what's numbered as page 9, it's a couple of\n15 pages in, do you see there is a head of household description\n16 on that page?\n17 A. Yes.\n18 Q. One of the people that's listed as an individual in the\n19 household is Robert J. Conrad, correct?\n20 A. Not under \"Head of Household.\" But where it says\n21 \"Additional Individuals,\" it has \"Robert J. Conrad, spouse.\"\n22 Q. Spouse, correct?\n23 A. Right.\n24 Q. You know now, looking at the email traffic from May 12th,\n25 that Ms. Trzaskoma had identified Robert J. Conrad as an\nSOUTHERN DISTRICT REPORTERS, P.C.\n(212) 805-0300\nDOJ-OGR-00010054",
  "text_blocks": [
    {
      "type": "printed",
      "content": "C2grdau2 Brune - redirect 314",
      "position": "header"
    },
    {
      "type": "printed",
      "content": "1 Q. Further down, under \"Addresses\" it has a Bronxville\n2 address, correct?\n3 A. At the top it has the Bronx address. Then there are a\n4 whole bunch of other addresses, including the Bronxville\n5 address.\n6 Q. If you turn the page, there are listings of various\n7 lawsuits, correct?\n8 A. I am now on page 2, and you're right, there are some\n9 lawsuits listed there.\n10 Q. Including one that relates or has listed a Bronxville\n11 address, correct, under New York docket judgment at the bottom\n12 there on page 2?\n13 A. Yes.\n14 Q. If you turn to what's numbered as page 9, it's a couple of\n15 pages in, do you see there is a head of household description\n16 on that page?\n17 A. Yes.\n18 Q. One of the people that's listed as an individual in the\n19 household is Robert J. Conrad, correct?\n20 A. Not under \"Head of Household.\" But where it says\n21 \"Additional Individuals,\" it has \"Robert J. Conrad, spouse.\"\n22 Q. Spouse, correct?\n23 A. Right.\n24 Q. You know now, looking at the email traffic from May 12th,\n25 that Ms. Trzaskoma had identified Robert J. Conrad as an",
      "position": "main content"
    },
    {
      "type": "printed",
      "content": "SOUTHERN DISTRICT REPORTERS, P.C.\n(212) 805-0300",
      "position": "footer"
    },
    {
      "type": "printed",
      "content": "DOJ-OGR-00010054",
      "position": "footer"
    }
  ],
  "entities": {
    "people": [
      "Robert J. Conrad",
      "Ms. Trzaskoma",
      "Brune"
    ],
    "organizations": [
      "SOUTHERN DISTRICT REPORTERS, P.C."
    ],
    "locations": [
      "Bronxville",
      "New York",
      "Bronx"
    ],
    "dates": [
      "May 12th"
    ],
    "reference_numbers": [
      "A-5771",
      "DOJ-OGR-00010054"
    ]
  },
  "additional_notes": "The document appears to be a transcript or deposition with a clear Q&A format. The content is related to a legal case involving Robert J. Conrad and addresses in Bronxville and Bronx. The footer contains a reference number and the name of the reporting agency."
}