{
  "document_metadata": {
    "page_number": "88",
    "document_number": "741",
    "date": "08/10/22",
    "document_type": "court transcript",
    "has_handwriting": false,
    "has_stamps": false
  },
  "full_text": "Case 1:20-cr-00330-PAE Document 741 Filed 08/10/22 Page 88 of 106 101 LBTCMAX4 Visoski - direct 1 A. Yes, I do. 2 Q. What is it? 3 A. That is the pool area of Mr. Epstein's Palm Beach house. 4 Q. Is this a fair and accurate depiction of another portion of 5 the exterior of Mr. Epstein's Palm Beach residence? 6 A. Yes, it is. 7 MS. COMEY: Your Honor, the government offers this in 8 evidence. 9 MR. EVERDELL: No objection. 10 THE COURT: Government Exhibit 212 is admitted is and 11 you may publish. 12 (Government's Exhibit 212 received in evidence) 13 MS. COMEY: Thank you, your Honor. 14 Ms. Drescher, may you please publish this for the 15 jury. 16 Q. Mr. Visoski, could you please describe the interior of 17 Mr. Epstein's Palm Beach residence. 18 A. Yes. If we start at the front door, you walk into the 19 front door, there is an entrance courtyard area. Once you're 20 inside the house, there is just obviously a large waiting area. 21 I guess it's easy, the first day, if you just walk to 22 your left, there is a half of staircase or half a circle 23 staircase that leads you to the upstairs bedrooms. 24 Once you get upstairs, you walk straight down the 25 hallway, there is a master bedroom located at the end of that  SOUTHERN DISTRICT REPORTERS, P.C. (212) 805-0300 DOJ-OGR-00011753",
  "text_blocks": [
    {
      "type": "printed",
      "content": "Case 1:20-cr-00330-PAE Document 741 Filed 08/10/22 Page 88 of 106 101 LBTCMAX4 Visoski - direct",
      "position": "header"
    },
    {
      "type": "printed",
      "content": "1 A. Yes, I do. 2 Q. What is it? 3 A. That is the pool area of Mr. Epstein's Palm Beach house. 4 Q. Is this a fair and accurate depiction of another portion of 5 the exterior of Mr. Epstein's Palm Beach residence? 6 A. Yes, it is. 7 MS. COMEY: Your Honor, the government offers this in 8 evidence. 9 MR. EVERDELL: No objection. 10 THE COURT: Government Exhibit 212 is admitted is and 11 you may publish. 12 (Government's Exhibit 212 received in evidence) 13 MS. COMEY: Thank you, your Honor. 14 Ms. Drescher, may you please publish this for the 15 jury. 16 Q. Mr. Visoski, could you please describe the interior of 17 Mr. Epstein's Palm Beach residence. 18 A. Yes. If we start at the front door, you walk into the 19 front door, there is an entrance courtyard area. Once you're 20 inside the house, there is just obviously a large waiting area. 21 I guess it's easy, the first day, if you just walk to 22 your left, there is a half of staircase or half a circle 23 staircase that leads you to the upstairs bedrooms. 24 Once you get upstairs, you walk straight down the 25 hallway, there is a master bedroom located at the end of that",
      "position": "main"
    },
    {
      "type": "printed",
      "content": "SOUTHERN DISTRICT REPORTERS, P.C. (212) 805-0300 DOJ-OGR-00011753",
      "position": "footer"
    }
  ],
  "entities": {
    "people": [
      "Mr. Epstein",
      "Mr. Visoski",
      "Ms. Comey",
      "Mr. Everdell",
      "Ms. Drescher"
    ],
    "organizations": [
      "SOUTHERN DISTRICT REPORTERS, P.C."
    ],
    "locations": [
      "Palm Beach"
    ],
    "dates": [
      "08/10/22"
    ],
    "reference_numbers": [
      "1:20-cr-00330-PAE",
      "741",
      "212",
      "DOJ-OGR-00011753"
    ]
  },
  "additional_notes": "The document appears to be a court transcript with a clear and legible format. There are no visible redactions or damage."
}