{
  "document_metadata": {
    "page_number": "3 of 8",
    "document_number": "25-2",
    "date": "07/17/19",
    "document_type": "email",
    "has_handwriting": false,
    "has_stamps": false
  },
  "full_text": "Case 1:19-cr-00490-RMB Document 25-2 Filed 07/17/19 Page 3 of 8 From: Jeffrey Epstein Subject: Date: July 30, 2012 at 10:27 PM To: Deborah Anaya Cc: Darren Indyk I arrived today in new mexico will be in and out of the state for the next month. hope things are well The information contained in this communication is confidential, may be attorney-client privileged, may constitute inside information, and is intended only for the use of the addressee. It is the property of Jeffrey Epstein Unauthorized use, disclosure or copying of this communication or any part thereof is strictly prohibited and may be unlawful. If you have received this communication in error, please notify us immediately by return e-mail or by e-mail to and destroy this communication and all copies thereof, including all attachments. copyright -all rights reserved DOJ-OGR-00000460",
  "text_blocks": [
    {
      "type": "printed",
      "content": "Case 1:19-cr-00490-RMB Document 25-2 Filed 07/17/19 Page 3 of 8",
      "position": "header"
    },
    {
      "type": "printed",
      "content": "From: Jeffrey Epstein Subject: Date: July 30, 2012 at 10:27 PM To: Deborah Anaya Cc: Darren Indyk",
      "position": "top"
    },
    {
      "type": "printed",
      "content": "I arrived today in new mexico will be in and out of the state for the next month. hope things are well",
      "position": "middle"
    },
    {
      "type": "printed",
      "content": "The information contained in this communication is confidential, may be attorney-client privileged, may constitute inside information, and is intended only for the use of the addressee. It is the property of Jeffrey Epstein Unauthorized use, disclosure or copying of this communication or any part thereof is strictly prohibited and may be unlawful. If you have received this communication in error, please notify us immediately by return e-mail or by e-mail to and destroy this communication and all copies thereof, including all attachments. copyright -all rights reserved",
      "position": "middle"
    },
    {
      "type": "printed",
      "content": "DOJ-OGR-00000460",
      "position": "footer"
    }
  ],
  "entities": {
    "people": [
      "Jeffrey Epstein",
      "Deborah Anaya",
      "Darren Indyk"
    ],
    "organizations": [],
    "locations": [
      "New Mexico"
    ],
    "dates": [
      "July 30, 2012",
      "07/17/19"
    ],
    "reference_numbers": [
      "1:19-cr-00490-RMB",
      "25-2",
      "DOJ-OGR-00000460"
    ]
  },
  "additional_notes": "The email contains redactions in the 'To' and 'Cc' fields, as well as in the disclaimer section."
}