{
  "document_metadata": {
    "page_number": "117",
    "document_number": "17-295",
    "date": "07/26/17",
    "document_type": "transcript",
    "has_handwriting": false,
    "has_stamps": false
  },
  "full_text": "Censor & Associates Reporting and Transcription, Inc. Page 117 1 You object. You know the rules. You just 2 lectured me about the rules, Counsel. So why 3 don't you play by the rules? Or only when they 4 fit you? Why don't you grandstand a little more 5 now. Give us a five-minute speech, Mr. Leopold. 6 MR. LEOPOLD: Are you finished, for the 7 record? 8 MR. TEIN: I'm not talking to you. Do what 9 you want. 10 MR. LEOPOLD: Don't say anything yet. 11 BY MR. TEIN: 12 Q. your parents -- 13 MR. LEOPOLD: Hold it. Don't say anything 14 yet. Let me -- 15 BY MR. TEIN: 16 Q. Your parents, who filed the police report 17 are also liars. 18 MR. LEOPOLD: Don't answer the question. 19 We're not going to answer until I make the record. 20 I want to put on the record, now that Counsel 21 appears to be finished with his comments for the 22 record, that the previous question was 23 inappropriate, was intentionally misleading. 24 Now you can ask the question. 25 BY MR. TEIN: Ph. 561.682.0905 - Fax. 561.682.1771 1655 Palm Beach Lakes Blvd., Suite 500 - West Palm Beach, FL 33401 07/26/17 Page 2792 Public Records Request No.: 17-295 DOJ-OGR-00033105",
  "text_blocks": [
    {
      "type": "printed",
      "content": "Censor & Associates Reporting and Transcription, Inc.",
      "position": "header"
    },
    {
      "type": "printed",
      "content": "Page 117",
      "position": "header"
    },
    {
      "type": "printed",
      "content": "1 You object. You know the rules. You just 2 lectured me about the rules, Counsel. So why 3 don't you play by the rules? Or only when they 4 fit you? Why don't you grandstand a little more 5 now. Give us a five-minute speech, Mr. Leopold. 6 MR. LEOPOLD: Are you finished, for the 7 record? 8 MR. TEIN: I'm not talking to you. Do what 9 you want. 10 MR. LEOPOLD: Don't say anything yet. 11 BY MR. TEIN: 12 Q. your parents -- 13 MR. LEOPOLD: Hold it. Don't say anything 14 yet. Let me -- 15 BY MR. TEIN: 16 Q. Your parents, who filed the police report 17 are also liars. 18 MR. LEOPOLD: Don't answer the question. 19 We're not going to answer until I make the record. 20 I want to put on the record, now that Counsel 21 appears to be finished with his comments for the 22 record, that the previous question was 23 inappropriate, was intentionally misleading. 24 Now you can ask the question. 25 BY MR. TEIN:",
      "position": "main"
    },
    {
      "type": "printed",
      "content": "Ph. 561.682.0905 - Fax. 561.682.1771 1655 Palm Beach Lakes Blvd., Suite 500 - West Palm Beach, FL 33401",
      "position": "footer"
    },
    {
      "type": "printed",
      "content": "07/26/17 Page 2792 Public Records Request No.: 17-295 DOJ-OGR-00033105",
      "position": "footer"
    }
  ],
  "entities": {
    "people": [
      "MR. LEOPOLD",
      "MR. TEIN"
    ],
    "organizations": [
      "Censor & Associates Reporting and Transcription, Inc."
    ],
    "locations": [
      "West Palm Beach",
      "FL"
    ],
    "dates": [
      "07/26/17"
    ],
    "reference_numbers": [
      "17-295",
      "DOJ-OGR-00033105"
    ]
  },
  "additional_notes": "The document appears to be a transcript of a legal proceeding. There is a redacted section on line 12."
}