{
  "document_metadata": {
    "page_number": "64",
    "document_number": "79",
    "date": "06/29/2023",
    "document_type": "court document",
    "has_handwriting": false,
    "has_stamps": false
  },
  "full_text": "Case 22-1426, Document 79, 06/29/2023, 3536060, Page64 of 93\n\n51\n\nsexual harassment, sexual abuse, or sexual assault, and that this experience would not affect their ability to serve fairly and impartially as a juror in the case.12 (A.344-45; Voir Dire Tr.18, 52, 200, 207, 259, 293, 532, 538-39, 635). Each confirmed that he or she could be fair and impartial, and defense counsel did not move to strike any these jurors for cause based on their answer to Question 48. (A.345).\n\nFor instance, one juror said that she was \"sexually molested by an uncle when she was 12 or 13,\" but that would not affect her ability to be fair and impartial in the case. (A.345). Another juror indicated that she had recently \"reported that a friend was being coerced and sexually abused by a professor,\" but confirmed that experience would not \"in any way interfere with her ability to be fair and impartial\" in this case. (Id.). Neither the Government nor defense counsel challenged those jurors for cause.\n\nThe parties then exercised their peremptory strikes, and a jury was seated.\n\n2. Juror 50\n\nJuror 50 completed the questionnaire and was questioned by Judge Nathan during voir dire. In his questionnaire, Juror 50 repeatedly made clear that he could be fair and impartial. In response to Question 13,\n\n12 Twelve of the 58 qualified prospective jurors indicated that a friend or family member had been a victim of sexual harassment, sexual abuse, or sexual assault.\n\nDOJ-OGR-00021711",
  "text_blocks": [
    {
      "type": "printed",
      "content": "Case 22-1426, Document 79, 06/29/2023, 3536060, Page64 of 93",
      "position": "header"
    },
    {
      "type": "printed",
      "content": "51",
      "position": "top"
    },
    {
      "type": "printed",
      "content": "sexual harassment, sexual abuse, or sexual assault, and that this experience would not affect their ability to serve fairly and impartially as a juror in the case.12 (A.344-45; Voir Dire Tr.18, 52, 200, 207, 259, 293, 532, 538-39, 635). Each confirmed that he or she could be fair and impartial, and defense counsel did not move to strike any these jurors for cause based on their answer to Question 48. (A.345).",
      "position": "middle"
    },
    {
      "type": "printed",
      "content": "For instance, one juror said that she was \"sexually molested by an uncle when she was 12 or 13,\" but that would not affect her ability to be fair and impartial in the case. (A.345). Another juror indicated that she had recently \"reported that a friend was being coerced and sexually abused by a professor,\" but confirmed that experience would not \"in any way interfere with her ability to be fair and impartial\" in this case. (Id.). Neither the Government nor defense counsel challenged those jurors for cause.",
      "position": "middle"
    },
    {
      "type": "printed",
      "content": "The parties then exercised their peremptory strikes, and a jury was seated.",
      "position": "middle"
    },
    {
      "type": "printed",
      "content": "2. Juror 50",
      "position": "middle"
    },
    {
      "type": "printed",
      "content": "Juror 50 completed the questionnaire and was questioned by Judge Nathan during voir dire. In his questionnaire, Juror 50 repeatedly made clear that he could be fair and impartial. In response to Question 13,",
      "position": "middle"
    },
    {
      "type": "printed",
      "content": "12 Twelve of the 58 qualified prospective jurors indicated that a friend or family member had been a victim of sexual harassment, sexual abuse, or sexual assault.",
      "position": "footer"
    },
    {
      "type": "printed",
      "content": "DOJ-OGR-00021711",
      "position": "footer"
    }
  ],
  "entities": {
    "people": [
      "Judge Nathan"
    ],
    "organizations": [
      "Government"
    ],
    "locations": [],
    "dates": [
      "06/29/2023"
    ],
    "reference_numbers": [
      "22-1426",
      "79",
      "3536060",
      "DOJ-OGR-00021711"
    ]
  },
  "additional_notes": "The document appears to be a court transcript or legal document related to a case involving sexual harassment or assault. The text is mostly printed, with no visible handwriting or stamps. The document is well-formatted and easy to read."
}