{
  "document_metadata": {
    "page_number": "12",
    "document_number": "26",
    "date": "02/10/20",
    "document_type": "court transcript",
    "has_handwriting": false,
    "has_stamps": false
  },
  "full_text": "Case 1:19-cr-00830-AT Document 26 Filed 02/10/20 Page 12 of 15 12 k1u2NoeC kjc 1 THE COURT: That is my order. 2 MR. FOY: And I will be here. I just don't want there 3 to be any delay that creates that issue. 4 MR. FIGGINS: Your Honor -- sorry to cut you off. 5 Your Honor, I'm thankful Mr. Foy said that about the 6 family vacation. I am actually going to be in Italy on a 7 cruise June 1 through June 14. We fly back on the 15th of 8 June. 9 THE COURT: And you just forgot about it? 10 MR. FIGGINS: Your Honor, I don't keep my social 11 calendar. Luckily he said that and I realized that in June we 12 do have a cruise scheduled, and I didn't even know the date, so 13 I had to find out just now. 14 THE COURT: When do you return? 15 MR. FIGGINS: The 15th, and I don't even know what day 16 of the week that is, but . . . 17 THE COURT: We will start on the 22nd of June. 18 MR. FOY: Well, Judge, that's the time I was just 19 talking to you about. Right? That I'm trying to make 20 arrangements to travel with my family. Right? 21 THE COURT: Well, I understand that it is desirable to 22 have family time, but you also have an obligation to zealously 23 represent your client, and so we are going to start on the 24 22nd. 25 MR. FOY: So I don't understand. I mean, I have no SOUTHERN DISTRICT REPORTERS, P.C. (212) 805-0300 DOJ-OGR-00022015",
  "text_blocks": [
    {
      "type": "printed",
      "content": "Case 1:19-cr-00830-AT Document 26 Filed 02/10/20 Page 12 of 15 12",
      "position": "header"
    },
    {
      "type": "printed",
      "content": "k1u2NoeC kjc",
      "position": "header"
    },
    {
      "type": "printed",
      "content": "1 THE COURT: That is my order. 2 MR. FOY: And I will be here. I just don't want there 3 to be any delay that creates that issue. 4 MR. FIGGINS: Your Honor -- sorry to cut you off. 5 Your Honor, I'm thankful Mr. Foy said that about the 6 family vacation. I am actually going to be in Italy on a 7 cruise June 1 through June 14. We fly back on the 15th of 8 June. 9 THE COURT: And you just forgot about it? 10 MR. FIGGINS: Your Honor, I don't keep my social 11 calendar. Luckily he said that and I realized that in June we 12 do have a cruise scheduled, and I didn't even know the date, so 13 I had to find out just now. 14 THE COURT: When do you return? 15 MR. FIGGINS: The 15th, and I don't even know what day 16 of the week that is, but . . . 17 THE COURT: We will start on the 22nd of June. 18 MR. FOY: Well, Judge, that's the time I was just 19 talking to you about. Right? That I'm trying to make 20 arrangements to travel with my family. Right? 21 THE COURT: Well, I understand that it is desirable to 22 have family time, but you also have an obligation to zealously 23 represent your client, and so we are going to start on the 24 22nd. 25 MR. FOY: So I don't understand. I mean, I have no",
      "position": "main"
    },
    {
      "type": "printed",
      "content": "SOUTHERN DISTRICT REPORTERS, P.C. (212) 805-0300",
      "position": "footer"
    },
    {
      "type": "printed",
      "content": "DOJ-OGR-00022015",
      "position": "footer"
    }
  ],
  "entities": {
    "people": [
      "MR. FOY",
      "MR. FIGGINS"
    ],
    "organizations": [
      "SOUTHERN DISTRICT REPORTERS, P.C."
    ],
    "locations": [
      "Italy"
    ],
    "dates": [
      "02/10/20",
      "June 1",
      "June 14",
      "June 15",
      "June 22"
    ],
    "reference_numbers": [
      "1:19-cr-00830-AT",
      "26",
      "DOJ-OGR-00022015"
    ]
  },
  "additional_notes": "The document appears to be a court transcript with a clear and legible format. There are no visible redactions or damage."
}