{
  "document_metadata": {
    "page_number": "183",
    "document_number": "749",
    "date": "08/10/22",
    "document_type": "Court Transcript",
    "has_handwriting": false,
    "has_stamps": false
  },
  "full_text": "Case 1:20-cr-00330-PAE Document 749 Filed 08/10/22 Page 183 of 236 1087\nLC3KMAX6 Parkinson - Direct\n1 A. I do.\n2 Q. What is it?\n3 A. This is a desktop.\n4 Q. From where?\n5 A. This is in the same bathroom but a little bit of an anteroom.\n6\n7 Q. Is this a fair and accurate depiction of a portion of the interior of 358 El Brillo Way as it appeared on October 20, 2005?\n8\n9\n10 A. True.\n11 MS. COMEY: Your Honor, the government offers this exhibit under seal to protect the interests of a party.\n12\n13 MR. EVERDELL: No objection.\n14 THE COURT: 285 is admitted for the reason indicated.\n15 (Government's Exhibit 285 received in evidence)\n16 MS. COMEY: May we ask the jurors to turn in their binder to Government Exhibit 285, please?\n17\n18 THE COURT: Yes.\n19 Q. Mr. Parkinson, would you please read the writing in the lower center of this picture?\n20\n21 THE COURT: Sorry. It's admitted under seal.\n22 MS. COMEY: Ah, then I apologize, your Honor. May I direct the jurors' attention to that writing?\n23\n24 THE COURT: Sure.\n25 MS. COMEY: Thank you, your Honor. I am done with the\nSOUTHERN DISTRICT REPORTERS, P.C. (212) 805-0300\nDOJ-OGR-00012697",
  "text_blocks": [
    {
      "type": "printed",
      "content": "Case 1:20-cr-00330-PAE Document 749 Filed 08/10/22 Page 183 of 236 1087",
      "position": "header"
    },
    {
      "type": "printed",
      "content": "LC3KMAX6 Parkinson - Direct",
      "position": "header"
    },
    {
      "type": "printed",
      "content": "1 A. I do.\n2 Q. What is it?\n3 A. This is a desktop.\n4 Q. From where?\n5 A. This is in the same bathroom but a little bit of an anteroom.\n6\n7 Q. Is this a fair and accurate depiction of a portion of the interior of 358 El Brillo Way as it appeared on October 20, 2005?\n8\n9\n10 A. True.\n11 MS. COMEY: Your Honor, the government offers this exhibit under seal to protect the interests of a party.\n12\n13 MR. EVERDELL: No objection.\n14 THE COURT: 285 is admitted for the reason indicated.\n15 (Government's Exhibit 285 received in evidence)\n16 MS. COMEY: May we ask the jurors to turn in their binder to Government Exhibit 285, please?\n17\n18 THE COURT: Yes.\n19 Q. Mr. Parkinson, would you please read the writing in the lower center of this picture?\n20\n21 THE COURT: Sorry. It's admitted under seal.\n22 MS. COMEY: Ah, then I apologize, your Honor. May I direct the jurors' attention to that writing?\n23\n24 THE COURT: Sure.\n25 MS. COMEY: Thank you, your Honor. I am done with the",
      "position": "main"
    },
    {
      "type": "printed",
      "content": "SOUTHERN DISTRICT REPORTERS, P.C. (212) 805-0300",
      "position": "footer"
    },
    {
      "type": "printed",
      "content": "DOJ-OGR-00012697",
      "position": "footer"
    }
  ],
  "entities": {
    "people": [
      "MS. COMEY",
      "MR. EVERDELL",
      "Mr. Parkinson"
    ],
    "organizations": [
      "SOUTHERN DISTRICT REPORTERS, P.C."
    ],
    "locations": [
      "358 El Brillo Way"
    ],
    "dates": [
      "October 20, 2005",
      "08/10/22"
    ],
    "reference_numbers": [
      "1:20-cr-00330-PAE",
      "749",
      "285",
      "DOJ-OGR-00012697"
    ]
  },
  "additional_notes": "The document appears to be a court transcript with a clear and legible format. There are no visible redactions or damage."
}