{
  "document_metadata": {
    "page_number": "80",
    "document_number": "753",
    "date": "08/10/22",
    "document_type": "court transcript",
    "has_handwriting": false,
    "has_stamps": false
  },
  "full_text": "Case 1:20-cr-00330-PAE Document 753 Filed 08/10/22 Page 80 of 264 1506 LC7Cmax2 Flatley - cross 1 THE COURT: Overruled. 2 A. I have no idea. 3 Q. You don't know whether the computer was sitting in the middle of a kitchen that other people could access it; right? 4 5 A. I don't know where the computer was. 6 Q. You don't know who was around the computer at any particular point in time; correct? 7 8 A. The only thing I know is that there were three user accounts on the computer - two were created by default when the computer was made and the only other user account was Ghislaine. 9 10 11 Q. So anyone who used that computer was using that Ghislaine Maxwell user account; right? 12 13 A. That's correct. 14 15 Q. No other user account was used; correct? 16 A. That's correct. 17 Q. So if Ghislaine was not present with the computer when a document was made, that would suggest other people had access to the computer; correct? 18 19 A. I don't know who had access to the computer. 20 21 MS. MENNINGER: May I have one moment, your Honor? 22 THE COURT: You may. 23 MS. MENNINGER: No further questions of this witness. 24 Thank you. 25 THE COURT: Ms. Pomerantz? SOUTHERN DISTRICT REPORTERS, P.C. (212) 805-0300 DOJ-OGR-00013093",
  "text_blocks": [
    {
      "type": "printed",
      "content": "Case 1:20-cr-00330-PAE Document 753 Filed 08/10/22 Page 80 of 264 1506 LC7Cmax2 Flatley - cross",
      "position": "header"
    },
    {
      "type": "printed",
      "content": "1 THE COURT: Overruled. 2 A. I have no idea. 3 Q. You don't know whether the computer was sitting in the middle of a kitchen that other people could access it; right? 4 5 A. I don't know where the computer was. 6 Q. You don't know who was around the computer at any particular point in time; correct? 7 8 A. The only thing I know is that there were three user accounts on the computer - two were created by default when the computer was made and the only other user account was Ghislaine. 9 10 11 Q. So anyone who used that computer was using that Ghislaine Maxwell user account; right? 12 13 A. That's correct. 14 15 Q. No other user account was used; correct? 16 A. That's correct. 17 Q. So if Ghislaine was not present with the computer when a document was made, that would suggest other people had access to the computer; correct? 18 19 A. I don't know who had access to the computer. 20 21 MS. MENNINGER: May I have one moment, your Honor? 22 THE COURT: You may. 23 MS. MENNINGER: No further questions of this witness. 24 Thank you. 25 THE COURT: Ms. Pomerantz?",
      "position": "main content"
    },
    {
      "type": "printed",
      "content": "SOUTHERN DISTRICT REPORTERS, P.C. (212) 805-0300",
      "position": "footer"
    },
    {
      "type": "printed",
      "content": "DOJ-OGR-00013093",
      "position": "footer"
    }
  ],
  "entities": {
    "people": [
      "Ghislaine Maxwell",
      "Ghislaine",
      "Ms. Menninger",
      "Ms. Pomerantz"
    ],
    "organizations": [
      "SOUTHERN DISTRICT REPORTERS, P.C."
    ],
    "locations": [],
    "dates": [
      "08/10/22"
    ],
    "reference_numbers": [
      "1:20-cr-00330-PAE",
      "753",
      "DOJ-OGR-00013093"
    ]
  },
  "additional_notes": "The document appears to be a court transcript with a clear and legible format. There are no visible redactions or damage."
}