{
  "document_metadata": {
    "page_number": "24",
    "document_number": "767",
    "date": "08/10/22",
    "document_type": "Court Document",
    "has_handwriting": false,
    "has_stamps": false
  },
  "full_text": "Case 1:20-cr-00330-PAE Document 767 Filed 08/10/22 Page 24 of 257 2857 LCKVMAX2 Summations - Ms. Moe 1 felt any of this and it was very embarrassing. You know, it's all these mixed emotions. When you're 14, you have no idea what's going on. 4 Ladies and gentlemen, none of this was normal. It was not okay. It was deeply disturbing. They were molesting an underage girl. That's what Maxwell did. And Jane told you about all the ways in which she was sexually abused during these so-called massages. You saw in her face how hard it was for her to talk to you about that. It was hard to hear. 10 She told you about having to touch Epstein's penis, how Epstein touched her vagina and used vibrators; how he put a back massager on her vagina, even when she said it hurt. She told you that Maxwell touched her breasts, that there were hands everywhere. She also told you that Maxwell and Epstein would sometimes involve her in horrifying group encounters with other women. 17 The sexual abuse didn't just happen in Florida. You learned that Maxwell and Epstein started taking Jane on trips to Epstein's house in New York. She flew to New York on commercial flights, but also in the private jet. Ask yourselves, does it seem normal to you that two adults were spending their weekends on trips with a 14-year-old girl? 23 Absolutely not. There was nothing normal about that. And your common sense tells you they weren't bringing her to New York for some kind of scholarship or mentoring program. They were SOUTHERN DISTRICT REPORTERS, P.C. (212) 805-0300 DOJ-OGR-00014424",
  "text_blocks": [
    {
      "type": "printed",
      "content": "Case 1:20-cr-00330-PAE Document 767 Filed 08/10/22 Page 24 of 257 2857 LCKVMAX2 Summations - Ms. Moe",
      "position": "header"
    },
    {
      "type": "printed",
      "content": "1 felt any of this and it was very embarrassing. You know, it's all these mixed emotions. When you're 14, you have no idea what's going on. 4 Ladies and gentlemen, none of this was normal. It was not okay. It was deeply disturbing. They were molesting an underage girl. That's what Maxwell did. And Jane told you about all the ways in which she was sexually abused during these so-called massages. You saw in her face how hard it was for her to talk to you about that. It was hard to hear. 10 She told you about having to touch Epstein's penis, how Epstein touched her vagina and used vibrators; how he put a back massager on her vagina, even when she said it hurt. She told you that Maxwell touched her breasts, that there were hands everywhere. She also told you that Maxwell and Epstein would sometimes involve her in horrifying group encounters with other women. 17 The sexual abuse didn't just happen in Florida. You learned that Maxwell and Epstein started taking Jane on trips to Epstein's house in New York. She flew to New York on commercial flights, but also in the private jet. Ask yourselves, does it seem normal to you that two adults were spending their weekends on trips with a 14-year-old girl? 23 Absolutely not. There was nothing normal about that. And your common sense tells you they weren't bringing her to New York for some kind of scholarship or mentoring program. They were",
      "position": "main"
    },
    {
      "type": "printed",
      "content": "SOUTHERN DISTRICT REPORTERS, P.C. (212) 805-0300",
      "position": "footer"
    },
    {
      "type": "printed",
      "content": "DOJ-OGR-00014424",
      "position": "footer"
    }
  ],
  "entities": {
    "people": [
      "Maxwell",
      "Epstein",
      "Jane",
      "Ms. Moe"
    ],
    "organizations": [
      "SOUTHERN DISTRICT REPORTERS, P.C."
    ],
    "locations": [
      "Florida",
      "New York"
    ],
    "dates": [
      "08/10/22"
    ],
    "reference_numbers": [
      "1:20-cr-00330-PAE",
      "767",
      "DOJ-OGR-00014424"
    ]
  },
  "additional_notes": "The document appears to be a court transcript or legal document related to the case against Ghislaine Maxwell. The text discusses the sexual abuse of a minor, referred to as 'Jane', by Maxwell and Jeffrey Epstein. The document is typed and contains no handwritten text or stamps. The footer includes the name and contact information of the court reporters and a reference number."
}