{
  "document_metadata": {
    "page_number": "18",
    "document_number": "767",
    "date": "08/10/22",
    "document_type": "Summations",
    "has_handwriting": false,
    "has_stamps": false
  },
  "full_text": "Case 1:20-cr-00330-PAE Document 767 Filed 08/10/22 Page 18 of 257 2851\nLKVMAX2\nSummations - Ms. Moe\n1 That was by design. It was Maxwell's design. Maxwell was hanging out with these girls alone, isolating them and befriending them.\n2 And remember how Annie's mom told you that Epstein called her to invite Annie to New Mexico? Remember how Annie's mom explained that Epstein said about 20 to 25 girls would be there and so would his wife, Ghislaine. And remember how Annie told you that when she got to New Mexico, she found herself alone with Maxwell and Epstein? They were isolating these girls for a reason.\n3 Then came the next step in the playbook: Making these girls feel special, giving them gifts, making friends, giving them money, promising to help with their futures, promises like sending Annie on a trip to Thailand or helping to pay for Jane's voice lessons and tuition. They were building a relationship. They were building trust for what was going to come next.\n4 Once the girls were manipulated this way, Maxwell helped Epstein normalize sexual situations and sexual touching. For Annie, it started with Maxwell telling her how to massage Epstein's feet. And it escalated to Maxwell touching Annie's breasts in a so-called massage. For Kate too it started with Maxwell asking her to rub Epstein's feet. For Jane it started with Maxwell being topless by the pool, and then Maxwell talking about boyfriends and sex with Jane. And it escalated\n5 SOUTHERN DISTRICT REPORTERS, P.C. (212) 805-0300\n6 DOJ-OGR-00014418",
  "text_blocks": [
    {
      "type": "printed",
      "content": "Case 1:20-cr-00330-PAE Document 767 Filed 08/10/22 Page 18 of 257 2851",
      "position": "header"
    },
    {
      "type": "printed",
      "content": "LKVMAX2\nSummations - Ms. Moe",
      "position": "header"
    },
    {
      "type": "printed",
      "content": "1 That was by design. It was Maxwell's design. Maxwell was hanging out with these girls alone, isolating them and befriending them.\n2 And remember how Annie's mom told you that Epstein called her to invite Annie to New Mexico? Remember how Annie's mom explained that Epstein said about 20 to 25 girls would be there and so would his wife, Ghislaine. And remember how Annie told you that when she got to New Mexico, she found herself alone with Maxwell and Epstein? They were isolating these girls for a reason.\n3 Then came the next step in the playbook: Making these girls feel special, giving them gifts, making friends, giving them money, promising to help with their futures, promises like sending Annie on a trip to Thailand or helping to pay for Jane's voice lessons and tuition. They were building a relationship. They were building trust for what was going to come next.\n4 Once the girls were manipulated this way, Maxwell helped Epstein normalize sexual situations and sexual touching. For Annie, it started with Maxwell telling her how to massage Epstein's feet. And it escalated to Maxwell touching Annie's breasts in a so-called massage. For Kate too it started with Maxwell asking her to rub Epstein's feet. For Jane it started with Maxwell being topless by the pool, and then Maxwell talking about boyfriends and sex with Jane. And it escalated",
      "position": "main"
    },
    {
      "type": "printed",
      "content": "SOUTHERN DISTRICT REPORTERS, P.C. (212) 805-0300",
      "position": "footer"
    },
    {
      "type": "printed",
      "content": "DOJ-OGR-00014418",
      "position": "footer"
    }
  ],
  "entities": {
    "people": [
      "Maxwell",
      "Annie",
      "Epstein",
      "Ghislaine",
      "Jane",
      "Kate",
      "Ms. Moe"
    ],
    "organizations": [
      "SOUTHERN DISTRICT REPORTERS, P.C."
    ],
    "locations": [
      "New Mexico",
      "Thailand"
    ],
    "dates": [
      "08/10/22"
    ],
    "reference_numbers": [
      "1:20-cr-00330-PAE",
      "767",
      "DOJ-OGR-00014418"
    ]
  },
  "additional_notes": "The document appears to be a court transcript or legal document related to the case against Ghislaine Maxwell. The text discusses the alleged actions of Maxwell and Epstein in relation to several young girls. The document is typed and contains no handwritten text or stamps."
}