{
  "document_metadata": {
    "page_number": "192",
    "document_number": "753",
    "date": "08/10/22",
    "document_type": "court transcript",
    "has_handwriting": false,
    "has_stamps": false
  },
  "full_text": "Case 1:20-cr-00330-PAE Document 753 Filed 08/10/22 Page 192 of 264 1633 LC7Cmax6 Carolyn - cross 1 A. Yeah. 2 Q. Yes, you do? 3 A. Yes, I do. 4 Q. There were also, in connection with this lawsuit, what are called interrogatories that you answered under oath. Do you recall that? 5 6 A. That what? 7 8 Q. There were documents called interrogatories -- 9 A. I don't know what that -- what those are. 10 Q. They were questions sent by lawyers -- 11 A. Okay. 12 Q. -- to your lawyer for you to answer under oath. Do you recall that? 13 14 A. I didn't -- I don't -- don't know anything about that. 15 MR. PAGLIUCA: If we can show the witness 3505-043, 16 page 5, deposition page 12, lines 23 through 25. 17 Q. Have you had an opportunity to review that, Carolyn? 18 THE COURT: It just came up. 19 A. Yeah. Review -- which numbers am I? 20 Q. Sure. 21 A. The whole thing? 22 Q. You should be looking at page 12, lines 19 through 25. 23 MS. COMEY: Your Honor, is the question whether this 24 refreshes recollection? 25 THE COURT: I think that is the question. SOUTHERN DISTRICT REPORTERS, P.C. (212) 805-0300 DOJ-OGR-00013205",
  "text_blocks": [
    {
      "type": "printed",
      "content": "Case 1:20-cr-00330-PAE Document 753 Filed 08/10/22 Page 192 of 264 1633",
      "position": "header"
    },
    {
      "type": "handwritten",
      "content": "LC7Cmax6 Carolyn - cross",
      "position": "header"
    },
    {
      "type": "printed",
      "content": "1 A. Yeah. 2 Q. Yes, you do? 3 A. Yes, I do. 4 Q. There were also, in connection with this lawsuit, what are called interrogatories that you answered under oath. Do you recall that? 5 6 A. That what? 7 8 Q. There were documents called interrogatories -- 9 A. I don't know what that -- what those are. 10 Q. They were questions sent by lawyers -- 11 A. Okay. 12 Q. -- to your lawyer for you to answer under oath. Do you recall that? 13 14 A. I didn't -- I don't -- don't know anything about that. 15 MR. PAGLIUCA: If we can show the witness 3505-043, 16 page 5, deposition page 12, lines 23 through 25. 17 Q. Have you had an opportunity to review that, Carolyn? 18 THE COURT: It just came up. 19 A. Yeah. Review -- which numbers am I? 20 Q. Sure. 21 A. The whole thing? 22 Q. You should be looking at page 12, lines 19 through 25. 23 MS. COMEY: Your Honor, is the question whether this 24 refreshes recollection? 25 THE COURT: I think that is the question.",
      "position": "main"
    },
    {
      "type": "printed",
      "content": "SOUTHERN DISTRICT REPORTERS, P.C. (212) 805-0300",
      "position": "footer"
    },
    {
      "type": "printed",
      "content": "DOJ-OGR-00013205",
      "position": "footer"
    }
  ],
  "entities": {
    "people": [
      "Carolyn",
      "MR. PAGLIUCA",
      "MS. COMEY"
    ],
    "organizations": [
      "SOUTHERN DISTRICT REPORTERS, P.C."
    ],
    "locations": [],
    "dates": [
      "08/10/22"
    ],
    "reference_numbers": [
      "1:20-cr-00330-PAE",
      "753",
      "3505-043",
      "DOJ-OGR-00013205"
    ]
  },
  "additional_notes": "The document appears to be a court transcript with a clear and legible format. There are no visible redactions or damage."
}