{
  "document_metadata": {
    "page_number": "57",
    "document_number": "761",
    "date": "08/10/22",
    "document_type": "court transcript",
    "has_handwriting": false,
    "has_stamps": false
  },
  "full_text": "Case 1:20-cr-00330-PAE Document 761 Filed 08/10/22 Page 57 of 246 2352\nLCGCmax2 Espinosa - direct\n1 I do recall her residence on 65th Street.\n2 Q. Okay. What do you recall about the residence on 65th Street?\n3\n4 A. That was a townhouse with, I think, three levels.\n5 Q. And to your knowledge, did Ghislaine always retain her own residence in New York while you were at your job?\n6\n7 A. Yes.\n8 Q. To your knowledge, did she ever reside with Jeffrey Epstein?\n9\n10 A. No.\n11 Q. Are you familiar with a residence at 44 Kinnerton Street?\n12 A. Yes.\n13 Q. Whose residence was that?\n14 A. Ghislaine's.\n15 Q. And what city was that in?\n16 A. London.\n17 MS. POMERANTZ: Objection. Foundation, your Honor.\n18 THE COURT: Sustained.\n19 Q. Have you ever been to that residence?\n20 A. Yes.\n21 Q. When were you in that residence?\n22 A. Three years ago.\n23 Q. So do you know who owned that residence at the time you were there?\n24\n25 MS. POMERANTZ: Objection. Foundation.\nSOUTHERN DISTRICT REPORTERS, P.C. (212) 805-0300\nDOJ-OGR-00013916",
  "text_blocks": [
    {
      "type": "printed",
      "content": "Case 1:20-cr-00330-PAE Document 761 Filed 08/10/22 Page 57 of 246 2352",
      "position": "header"
    },
    {
      "type": "printed",
      "content": "LCGCmax2 Espinosa - direct",
      "position": "header"
    },
    {
      "type": "printed",
      "content": "1 I do recall her residence on 65th Street.\n2 Q. Okay. What do you recall about the residence on 65th Street?\n3\n4 A. That was a townhouse with, I think, three levels.\n5 Q. And to your knowledge, did Ghislaine always retain her own residence in New York while you were at your job?\n6\n7 A. Yes.\n8 Q. To your knowledge, did she ever reside with Jeffrey Epstein?\n9\n10 A. No.\n11 Q. Are you familiar with a residence at 44 Kinnerton Street?\n12 A. Yes.\n13 Q. Whose residence was that?\n14 A. Ghislaine's.\n15 Q. And what city was that in?\n16 A. London.\n17 MS. POMERANTZ: Objection. Foundation, your Honor.\n18 THE COURT: Sustained.\n19 Q. Have you ever been to that residence?\n20 A. Yes.\n21 Q. When were you in that residence?\n22 A. Three years ago.\n23 Q. So do you know who owned that residence at the time you were there?\n24\n25 MS. POMERANTZ: Objection. Foundation.",
      "position": "main"
    },
    {
      "type": "printed",
      "content": "SOUTHERN DISTRICT REPORTERS, P.C. (212) 805-0300",
      "position": "footer"
    },
    {
      "type": "printed",
      "content": "DOJ-OGR-00013916",
      "position": "footer"
    }
  ],
  "entities": {
    "people": [
      "Ghislaine",
      "Jeffrey Epstein",
      "MS. POMERANTZ"
    ],
    "organizations": [
      "SOUTHERN DISTRICT REPORTERS, P.C.",
      "THE COURT"
    ],
    "locations": [
      "New York",
      "London",
      "65th Street",
      "44 Kinnerton Street"
    ],
    "dates": [
      "08/10/22",
      "Three years ago"
    ],
    "reference_numbers": [
      "1:20-cr-00330-PAE",
      "761",
      "DOJ-OGR-00013916"
    ]
  },
  "additional_notes": "The document appears to be a court transcript with a clear and legible format. There are no visible redactions or damage."
}