{
  "document_metadata": {
    "page_number": "43",
    "document_number": "757",
    "date": "08/10/22",
    "document_type": "court transcript",
    "has_handwriting": false,
    "has_stamps": false
  },
  "full_text": "Case 1:20-cr-00330-PAE Document 757 Filed 08/10/22 Page 43 of 49 2016 LC9VMAXT Chapell - cross 1 belonged to Jeffrey Epstein, right? 2 A. Yes. 3 Q. And can you explain just how you were able to verify them? 4 A. I went back to the paper copies and verified the invoices 5 one by one. 6 Q. Okay. 7 MR. EVERDELL: Your Honor, I'm going to do this in 8 paper, if I could. May I approach? 9 THE COURT: You may. 10 MR. EVERDELL: Okay. 11 THE COURT: Showing the witness what's been marked as 12 Defendant's TC-1; is that correct? 13 MR. EVERDELL: Correct, your Honor. 14 THE COURT: Okay. 15 BY MR. EVERDELL: 16 Q. All right. Ms. Chapell, do you have in front of you what's 17 been marked for identification as Defendant's Exhibit TC-1? 18 A. Yes. 19 Q. Now, do you recognize what those are? 20 A. Yes. 21 Q. What are they? 22 A. Jeffrey Epstein invoices. 23 Q. Are those some of the records that were provided to you by 24 the defense? 25 A. Yes. SOUTHERN DISTRICT REPORTERS, P.C. (212) 805-0300 DOJ-OGR-00013584",
  "text_blocks": [
    {
      "type": "printed",
      "content": "Case 1:20-cr-00330-PAE Document 757 Filed 08/10/22 Page 43 of 49 2016",
      "position": "header"
    },
    {
      "type": "printed",
      "content": "LC9VMAXT Chapell - cross",
      "position": "header"
    },
    {
      "type": "printed",
      "content": "1 belonged to Jeffrey Epstein, right? 2 A. Yes. 3 Q. And can you explain just how you were able to verify them? 4 A. I went back to the paper copies and verified the invoices 5 one by one. 6 Q. Okay. 7 MR. EVERDELL: Your Honor, I'm going to do this in 8 paper, if I could. May I approach? 9 THE COURT: You may. 10 MR. EVERDELL: Okay. 11 THE COURT: Showing the witness what's been marked as 12 Defendant's TC-1; is that correct? 13 MR. EVERDELL: Correct, your Honor. 14 THE COURT: Okay. 15 BY MR. EVERDELL: 16 Q. All right. Ms. Chapell, do you have in front of you what's 17 been marked for identification as Defendant's Exhibit TC-1? 18 A. Yes. 19 Q. Now, do you recognize what those are? 20 A. Yes. 21 Q. What are they? 22 A. Jeffrey Epstein invoices. 23 Q. Are those some of the records that were provided to you by 24 the defense? 25 A. Yes.",
      "position": "main content"
    },
    {
      "type": "printed",
      "content": "SOUTHERN DISTRICT REPORTERS, P.C. (212) 805-0300",
      "position": "footer"
    },
    {
      "type": "printed",
      "content": "DOJ-OGR-00013584",
      "position": "footer"
    }
  ],
  "entities": {
    "people": [
      "Jeffrey Epstein",
      "Ms. Chapell",
      "MR. EVERDELL"
    ],
    "organizations": [
      "SOUTHERN DISTRICT REPORTERS, P.C."
    ],
    "locations": [],
    "dates": [
      "08/10/22"
    ],
    "reference_numbers": [
      "1:20-cr-00330-PAE",
      "757",
      "DOJ-OGR-00013584"
    ]
  },
  "additional_notes": "The document appears to be a court transcript with a clear and legible format. There are no visible redactions or damage."
}