{
  "document_metadata": {
    "page_number": "49",
    "document_number": "751",
    "date": "08/10/22",
    "document_type": "court transcript",
    "has_handwriting": false,
    "has_stamps": false
  },
  "full_text": "Case 1:20-cr-00330-PAE Document 751 Filed 08/10/22 Page 49 of 261 1189 LC6VMAX2 Kate - direct statements. A. She sounded really pleased. And I was really pleased that she was pleased. Q. Did you leave Maxwell's house? A. Yes. Q. Other than the three times that you saw Epstein at Maxwell's townhouse in London, did you see anyone else at her house? A. Can you repeat it? Q. Other than the three times you saw Epstein at Maxwell's townhouse in London, did you see anyone else at her house? A. Yes. Q. Who did you see? A. I saw a girl. Q. What did the girl look like? A. She was blond and slim and around my age. Q. Approximately how old were you when you saw the girl? A. Seventeen. Q. And what did you see the girl doing at Maxwell's townhouse? A. She was having tea with Ghislaine and telling -- telling Ghislaine about the things that she was interested in. Q. What, if anything, did Maxwell say to you about what she thought Epstein would think of the girl? A. Can you repeat it please. Q. What, if anything, did Maxwell say to you about what she SOUTHERN DISTRICT REPORTERS, P.C. (212) 805-0300 DOJ-OGR-00012800",
  "text_blocks": [
    {
      "type": "printed",
      "content": "Case 1:20-cr-00330-PAE Document 751 Filed 08/10/22 Page 49 of 261 1189 LC6VMAX2 Kate - direct",
      "position": "header"
    },
    {
      "type": "printed",
      "content": "statements. A. She sounded really pleased. And I was really pleased that she was pleased. Q. Did you leave Maxwell's house? A. Yes. Q. Other than the three times that you saw Epstein at Maxwell's townhouse in London, did you see anyone else at her house? A. Can you repeat it? Q. Other than the three times you saw Epstein at Maxwell's townhouse in London, did you see anyone else at her house? A. Yes. Q. Who did you see? A. I saw a girl. Q. What did the girl look like? A. She was blond and slim and around my age. Q. Approximately how old were you when you saw the girl? A. Seventeen. Q. And what did you see the girl doing at Maxwell's townhouse? A. She was having tea with Ghislaine and telling -- telling Ghislaine about the things that she was interested in. Q. What, if anything, did Maxwell say to you about what she thought Epstein would think of the girl? A. Can you repeat it please. Q. What, if anything, did Maxwell say to you about what she",
      "position": "middle"
    },
    {
      "type": "printed",
      "content": "SOUTHERN DISTRICT REPORTERS, P.C. (212) 805-0300",
      "position": "footer"
    },
    {
      "type": "printed",
      "content": "DOJ-OGR-00012800",
      "position": "footer"
    }
  ],
  "entities": {
    "people": [
      "Maxwell",
      "Epstein",
      "Ghislaine",
      "Kate"
    ],
    "organizations": [
      "SOUTHERN DISTRICT REPORTERS, P.C."
    ],
    "locations": [
      "London"
    ],
    "dates": [
      "08/10/22"
    ],
    "reference_numbers": [
      "1:20-cr-00330-PAE",
      "751",
      "DOJ-OGR-00012800"
    ]
  },
  "additional_notes": "The document appears to be a court transcript from a case involving Maxwell and Epstein. The text is mostly printed, with no visible handwriting or stamps. The footer contains the name and contact information of the reporting agency and a reference number."
}