{
  "document_metadata": {
    "page_number": "185",
    "document_number": "745",
    "date": "08/10/22",
    "document_type": "court transcript",
    "has_handwriting": false,
    "has_stamps": false
  },
  "full_text": "Case 1:20-cr-00330-PAE Document 745 Filed 08/10/22 Page 185 of 264 596 LC1VMAX5 Jane - cross 1 MS. MOE: Objection. 2 THE COURT: Overruled. 3 A. I don't remember. 4 Q. You might have been 15 or it might have been some other date, right? 5 A. Right. 6 Q. You moved to New York in or around 1998, right? 7 A. Yes. 8 Q. And you went to your senior year here from '98 to '99? 9 A. Yes. 10 Q. What you put in your civil complaint is that you moved to New York in 1996 to go to school here; correct? 11 A. I don't remember saying that. 12 Q. Let's go back to 3509-007, paragraph 20. And in your civil complaint, you alleged that you moved to New York in 1996 when you were 16; correct? 13 A. No, I don't think I said that, because I didn't move to New York then. 14 Q. Do you want to look at the first page of this? 15 A. No, I -- I know. I know what it is. 16 Q. You know your lawyer signed it? 17 A. Yes. 18 Q. The lawyer that you met with the government with multiple times, right? 19 A. Yes. 20 SOUTHERN DISTRICT REPORTERS, P.C. (212) 805-0300 DOJ-OGR-00012205",
  "text_blocks": [
    {
      "type": "printed",
      "content": "Case 1:20-cr-00330-PAE Document 745 Filed 08/10/22 Page 185 of 264 596 LC1VMAX5 Jane - cross",
      "position": "header"
    },
    {
      "type": "printed",
      "content": "MS. MOE: Objection. THE COURT: Overruled. A. I don't remember. Q. You might have been 15 or it might have been some other date, right? A. Right. Q. You moved to New York in or around 1998, right? A. Yes. Q. And you went to your senior year here from '98 to '99? A. Yes. Q. What you put in your civil complaint is that you moved to New York in 1996 to go to school here; correct? A. I don't remember saying that. Q. Let's go back to 3509-007, paragraph 20. And in your civil complaint, you alleged that you moved to New York in 1996 when you were 16; correct? A. No, I don't think I said that, because I didn't move to New York then. Q. Do you want to look at the first page of this? A. No, I -- I know. I know what it is. Q. You know your lawyer signed it? A. Yes. Q. The lawyer that you met with the government with multiple times, right? A. Yes.",
      "position": "main"
    },
    {
      "type": "printed",
      "content": "SOUTHERN DISTRICT REPORTERS, P.C. (212) 805-0300",
      "position": "footer"
    },
    {
      "type": "printed",
      "content": "DOJ-OGR-00012205",
      "position": "footer"
    }
  ],
  "entities": {
    "people": [
      "MS. MOE"
    ],
    "organizations": [
      "SOUTHERN DISTRICT REPORTERS, P.C.",
      "THE COURT"
    ],
    "locations": [
      "New York"
    ],
    "dates": [
      "08/10/22",
      "1996",
      "1998",
      "'98",
      "'99"
    ],
    "reference_numbers": [
      "1:20-cr-00330-PAE",
      "745",
      "3509-007",
      "DOJ-OGR-00012205"
    ]
  },
  "additional_notes": "The document appears to be a court transcript with a clear and legible format. There are no visible redactions or damage."
}