{
  "document_metadata": {
    "page_number": "73",
    "document_number": "761",
    "date": "08/10/22",
    "document_type": "court transcript",
    "has_handwriting": false,
    "has_stamps": false
  },
  "full_text": "Case 1:20-cr-00330-PAE Document 761 Filed 08/10/22 Page 73 of 246 2368 LCGCmax2 Espinosa - direct 1 Q. Do you remember any of the names of the people who had regular apartments in that building, who regularly stayed there? 2 A. Yes. 3 Q. Who were some of those people? 4 A. Jeffrey Epstein's pilots had apartments there. Jane stayed 5 there, Jane's mother, Jane's brothers. We had -- let's see. 6 There were some other executives that Jeffrey knew. Can't 7 really recall other names. Shelly Lewis had an apartment there 8 for a while. 9 Q. Who was Shelly Lewis? 10 A. Shelly was one of Jeffrey's friends, I guess. 11 Q. Okay. Do you know if Emmy Taylor ever had an apartment 12 there? 13 A. Emmy Taylor had an apartment there. 14 (Continued on next page) 15 16 17 18 19 20 21 22 23 24 25 SOUTHERN DISTRICT REPORTERS, P.C. (212) 805-0300 DOJ-OGR-00013932",
  "text_blocks": [
    {
      "type": "printed",
      "content": "Case 1:20-cr-00330-PAE Document 761 Filed 08/10/22 Page 73 of 246 2368",
      "position": "header"
    },
    {
      "type": "printed",
      "content": "LCGCmax2 Espinosa - direct",
      "position": "header"
    },
    {
      "type": "printed",
      "content": "Q. Do you remember any of the names of the people who had regular apartments in that building, who regularly stayed there? A. Yes. Q. Who were some of those people? A. Jeffrey Epstein's pilots had apartments there. Jane stayed there, Jane's mother, Jane's brothers. We had -- let's see. There were some other executives that Jeffrey knew. Can't really recall other names. Shelly Lewis had an apartment there for a while. Q. Who was Shelly Lewis? A. Shelly was one of Jeffrey's friends, I guess. Q. Okay. Do you know if Emmy Taylor ever had an apartment there? A. Emmy Taylor had an apartment there. (Continued on next page)",
      "position": "main"
    },
    {
      "type": "printed",
      "content": "SOUTHERN DISTRICT REPORTERS, P.C. (212) 805-0300",
      "position": "footer"
    },
    {
      "type": "printed",
      "content": "DOJ-OGR-00013932",
      "position": "footer"
    }
  ],
  "entities": {
    "people": [
      "Jeffrey Epstein",
      "Jane",
      "Jane's mother",
      "Jane's brothers",
      "Shelly Lewis",
      "Emmy Taylor"
    ],
    "organizations": [
      "SOUTHERN DISTRICT REPORTERS, P.C."
    ],
    "locations": [],
    "dates": [
      "08/10/22"
    ],
    "reference_numbers": [
      "1:20-cr-00330-PAE",
      "761",
      "DOJ-OGR-00013932"
    ]
  },
  "additional_notes": "The document appears to be a court transcript with a clear and legible format. There are no visible redactions or damage."
}