{
  "document_metadata": {
    "page_number": "44 of 167",
    "document_number": "563",
    "date": "12/18/21",
    "document_type": "court document",
    "has_handwriting": false,
    "has_stamps": false
  },
  "full_text": "Case 1:20-cr-00330-PAE Document 563 Filed 12/18/21 Page 44 of 167\n1 Instruction No. 32: Counts One, Three, and Five: Conspiracy to Violate Federal Law – The Elements\n2\n3 To prove the Defendant guilty of the crime of conspiracy, the Government must\n4 prove each of the following four elements beyond a reasonable doubt:\n5 First, that two or more persons entered the unlawful agreement charged in the particular count of the Indictment;\n6\n7 Second, that the Defendant knowingly and willfully became a member of that conspiracy;\n8 Third, that one of the members of the conspiracy knowingly committed at least one overt\n9 act; and\n10 Fourth, that the overt act which you find to have been committed was committed to\n11 further some objective of that conspiracy.\n12 Each of these elements must be satisfied beyond a reasonable doubt.\n13 Now let us separately consider each of these elements.\n43\nDOJ-OGR-00008582",
  "text_blocks": [
    {
      "type": "printed",
      "content": "Case 1:20-cr-00330-PAE Document 563 Filed 12/18/21 Page 44 of 167",
      "position": "header"
    },
    {
      "type": "printed",
      "content": "Instruction No. 32: Counts One, Three, and Five: Conspiracy to Violate Federal Law – The Elements",
      "position": "header"
    },
    {
      "type": "printed",
      "content": "To prove the Defendant guilty of the crime of conspiracy, the Government must prove each of the following four elements beyond a reasonable doubt: First, that two or more persons entered the unlawful agreement charged in the particular count of the Indictment; Second, that the Defendant knowingly and willfully became a member of that conspiracy; Third, that one of the members of the conspiracy knowingly committed at least one overt act; and Fourth, that the overt act which you find to have been committed was committed to further some objective of that conspiracy. Each of these elements must be satisfied beyond a reasonable doubt. Now let us separately consider each of these elements.",
      "position": "main content"
    },
    {
      "type": "printed",
      "content": "43",
      "position": "footer"
    },
    {
      "type": "printed",
      "content": "DOJ-OGR-00008582",
      "position": "footer"
    }
  ],
  "entities": {
    "people": [
      "Defendant"
    ],
    "organizations": [
      "Government"
    ],
    "locations": [],
    "dates": [
      "12/18/21"
    ],
    "reference_numbers": [
      "1:20-cr-00330-PAE",
      "563",
      "DOJ-OGR-00008582"
    ]
  },
  "additional_notes": "The document appears to be a court filing related to a conspiracy case. The text is printed and there are no visible stamps or handwritten notes. The document is paginated, with this page being 44 of 167."
}