{
  "document_metadata": {
    "page_number": "1 of 12",
    "document_number": "441",
    "date": "11/12/21",
    "document_type": "Court Document",
    "has_handwriting": false,
    "has_stamps": false
  },
  "full_text": "Case 1:20-cr-00330-PAE Document 441 Filed 11/12/21 Page 1 of 12 UNITED STATES DISTRICT COURT SOUTHERN DISTRICT OF NEW YORK ---------------------------------------------------------------X UNITED STATES OF AMERICA, v. 20 Cr. 330 (AJN) GHISLAINE MAXWELL, Defendant. ---------------------------------------------------------------X GHISLAINE MAXWELL'S MOTION TO PRECLUDE THE INTRODUCTION OF ALLEGED CO-CONSPIRATOR STATEMENTS AS A SANCTION FOR FAILING TO COMPLY WITH THIS COURT'S SEPTEMBER 3, 2021, ORDER Jeffrey S. Pagliuca Laura A. Menninger HADDON, MORGAN & FOREMAN, P.C. 150 East 10th Avenue Denver, CO 80203 Phone: 303-831-7364 Christian R. Everdell COHEN & GRESSER LLP 800 Third Avenue New York, NY 10022 Phone: 212-957-7600 Bobbi C. Sternheim Law Offices of Bobbi C. Sternheim 225 Broadway, Suite 715 New York, NY 10007 Phone: 212-243-1100 Attorneys for Ghislaine Maxwell DOJ-OGR-00006557",
  "text_blocks": [
    {
      "type": "printed",
      "content": "Case 1:20-cr-00330-PAE Document 441 Filed 11/12/21 Page 1 of 12",
      "position": "header"
    },
    {
      "type": "printed",
      "content": "UNITED STATES DISTRICT COURT SOUTHERN DISTRICT OF NEW YORK ---------------------------------------------------------------X UNITED STATES OF AMERICA, v. 20 Cr. 330 (AJN) GHISLAINE MAXWELL, Defendant. ---------------------------------------------------------------X",
      "position": "top"
    },
    {
      "type": "printed",
      "content": "GHISLAINE MAXWELL'S MOTION TO PRECLUDE THE INTRODUCTION OF ALLEGED CO-CONSPIRATOR STATEMENTS AS A SANCTION FOR FAILING TO COMPLY WITH THIS COURT'S SEPTEMBER 3, 2021, ORDER",
      "position": "middle"
    },
    {
      "type": "printed",
      "content": "Jeffrey S. Pagliuca Laura A. Menninger HADDON, MORGAN & FOREMAN, P.C. 150 East 10th Avenue Denver, CO 80203 Phone: 303-831-7364 Christian R. Everdell COHEN & GRESSER LLP 800 Third Avenue New York, NY 10022 Phone: 212-957-7600 Bobbi C. Sternheim Law Offices of Bobbi C. Sternheim 225 Broadway, Suite 715 New York, NY 10007 Phone: 212-243-1100 Attorneys for Ghislaine Maxwell",
      "position": "middle"
    },
    {
      "type": "printed",
      "content": "DOJ-OGR-00006557",
      "position": "footer"
    }
  ],
  "entities": {
    "people": [
      "Ghislaine Maxwell",
      "Jeffrey S. Pagliuca",
      "Laura A. Menninger",
      "Christian R. Everdell",
      "Bobbi C. Sternheim"
    ],
    "organizations": [
      "HADDON, MORGAN & FOREMAN, P.C.",
      "COHEN & GRESSER LLP",
      "Law Offices of Bobbi C. Sternheim",
      "UNITED STATES DISTRICT COURT",
      "UNITED STATES OF AMERICA"
    ],
    "locations": [
      "New York",
      "Denver",
      "CO",
      "NY"
    ],
    "dates": [
      "11/12/21",
      "September 3, 2021"
    ],
    "reference_numbers": [
      "1:20-cr-00330-PAE",
      "Document 441",
      "20 Cr. 330 (AJN)",
      "DOJ-OGR-00006557"
    ]
  },
  "additional_notes": "The document appears to be a court filing in a criminal case against Ghislaine Maxwell. The text is clear and legible, with no visible redactions or damage."
}