{
  "document_metadata": {
    "page_number": "9",
    "document_number": "1:13-cr-00320-PGG",
    "date": "11/16/2013",
    "document_type": "Indictment",
    "has_handwriting": true,
    "has_stamps": false
  },
  "full_text": "Case 1:13-cr-00320-PGG Document 158 Filed 07/16/21 Page 9 of 11 travel from New Jersey to the Bronx, New York, where he held her against her will inside his apartment. (Title 18, United States Code, Section 1201(a)(1) and (g)(1).) COUNT TEN (Firearms Offense Related to Kidnapping) The Grand Jury further charges: 10. On or about November 16, 2013, in the Southern District of New York and elsewhere, CLAUDIUS ENGLISH, a/k/a \"Jay Barnes,\" a/k/a \"Brent English,\" the defendant, knowingly, during and in relation to a crime of violence for which he may be prosecuted in a court of the United States, namely, the kidnapping offense charged in Count Nine of this Indictment, did use and carry a firearm, and, in furtherance of such crime, did possess a firearm, which was brandished, to wit, ENGLISH brandished a firearm at Minor Victim-7 in the course of kidnapping her, as charged in Count Nine. (Title 18, United States Code, Section 924(c)(1)(A)(i) and (ii).) FORPERSON GEOFFREY S. BERMAN United States Attorney",
  "text_blocks": [
    {
      "type": "printed",
      "content": "Case 1:13-cr-00320-PGG Document 158 Filed 07/16/21 Page 9 of 11",
      "position": "header"
    },
    {
      "type": "printed",
      "content": "travel from New Jersey to the Bronx, New York, where he held her against her will inside his apartment. (Title 18, United States Code, Section 1201(a)(1) and (g)(1).) COUNT TEN (Firearms Offense Related to Kidnapping) The Grand Jury further charges: 10. On or about November 16, 2013, in the Southern District of New York and elsewhere, CLAUDIUS ENGLISH, a/k/a \"Jay Barnes,\" a/k/a \"Brent English,\" the defendant, knowingly, during and in relation to a crime of violence for which he may be prosecuted in a court of the United States, namely, the kidnapping offense charged in Count Nine of this Indictment, did use and carry a firearm, and, in furtherance of such crime, did possess a firearm, which was brandished, to wit, ENGLISH brandished a firearm at Minor Victim-7 in the course of kidnapping her, as charged in Count Nine. (Title 18, United States Code, Section 924(c)(1)(A)(i) and (ii).)",
      "position": "main"
    },
    {
      "type": "handwritten",
      "content": "FORPERSON",
      "position": "bottom"
    },
    {
      "type": "printed",
      "content": "GEOFFREY S. BERMAN United States Attorney",
      "position": "bottom"
    },
    {
      "type": "signature",
      "content": "Geoffrey S. Berman",
      "position": "bottom"
    }
  ],
  "entities": {
    "people": [
      "Claudius English",
      "Jay Barnes",
      "Brent English",
      "Geoffrey S. Berman",
      "Minor Victim-7"
    ],
    "organizations": [
      "United States Attorney"
    ],
    "locations": [
      "New Jersey",
      "Bronx",
      "New York",
      "Southern District of New York"
    ],
    "dates": [
      "November 16, 2013",
      "07/16/21"
    ],
    "reference_numbers": [
      "1:13-cr-00320-PGG",
      "Document 158",
      "Count Nine",
      "Count Ten"
    ]
  },
  "additional_notes": "The document appears to be a page from a legal indictment. It contains both printed and handwritten text. The signatures of the foreperson and the United States Attorney are present at the bottom of the page."
}