{
  "document_metadata": {
    "page_number": "158",
    "document_number": "499-1",
    "date": "11/23/21",
    "document_type": "court document",
    "has_handwriting": false,
    "has_stamps": false
  },
  "full_text": "Case 1:20-cr-00330-PAE Document 499-1 Filed 11/23/21 Page 158 of 375\nPark Dietz, M.D., M.P.H., Ph.D.\nPage 96\n- Red Ball (2005)\n- In God We Trust (2005)\n- Publish and Perish (2005)\n- Tombstone (2005)\n- Sects (2005)\n- Dining Out (2005)\n- License to Kill (2005)\n- The Sixth Man (2005)\n- Fluency (2005)\n- Ain't No Love (2005)\n- Fixed (2004)\n- Enemy (2004)\n- All in the Family (2004)\n- Cry Wolf (2004)\n- Gunplay (2004)\n- Coming Down Hard (2004)\n- The Brotherhood (2004)\n- The Dead Wives Club (2004)\n- C.O.D. (2004)\n- Caviar Emptor (2004)\n- Gaijin (2004)\n- Vendetta (2004)\n- Nowhere Man (2004)\n- Evil Breeds (2004)\n- City Hall (2004)\n- Darwinian (2004)\n- Embedded (2003)\n- Bounty (2003)\n- Bodies (2003)\n- Sheltered (2003)\n- Suicide Box (2003)\n- B*tch (2003)\n- Star Crossed (2003)\n- Absentia (2003)\n- Under God (2003)\n- Chosen (2003)\n- Open Season (2002)\n- Tragedy on Rye (2002)\n- Patriot (2002)\n- Oxymoron (2002)\n- Attorney Client (2002)\n- Dazzled (2002)\n- Slaughter (2002)\n- Equal Rights (2002)\nDOJ-OGR-00007651",
  "text_blocks": [
    {
      "type": "printed",
      "content": "Case 1:20-cr-00330-PAE Document 499-1 Filed 11/23/21 Page 158 of 375",
      "position": "header"
    },
    {
      "type": "printed",
      "content": "Park Dietz, M.D., M.P.H., Ph.D.\nPage 96",
      "position": "top"
    },
    {
      "type": "printed",
      "content": "- Red Ball (2005)\n- In God We Trust (2005)\n- Publish and Perish (2005)\n- Tombstone (2005)\n- Sects (2005)\n- Dining Out (2005)\n- License to Kill (2005)\n- The Sixth Man (2005)\n- Fluency (2005)\n- Ain't No Love (2005)\n- Fixed (2004)\n- Enemy (2004)\n- All in the Family (2004)\n- Cry Wolf (2004)\n- Gunplay (2004)\n- Coming Down Hard (2004)\n- The Brotherhood (2004)\n- The Dead Wives Club (2004)\n- C.O.D. (2004)\n- Caviar Emptor (2004)\n- Gaijin (2004)\n- Vendetta (2004)\n- Nowhere Man (2004)\n- Evil Breeds (2004)\n- City Hall (2004)\n- Darwinian (2004)\n- Embedded (2003)\n- Bounty (2003)\n- Bodies (2003)\n- Sheltered (2003)\n- Suicide Box (2003)\n- B*tch (2003)\n- Star Crossed (2003)\n- Absentia (2003)\n- Under God (2003)\n- Chosen (2003)\n- Open Season (2002)\n- Tragedy on Rye (2002)\n- Patriot (2002)\n- Oxymoron (2002)\n- Attorney Client (2002)\n- Dazzled (2002)\n- Slaughter (2002)\n- Equal Rights (2002)",
      "position": "middle"
    },
    {
      "type": "printed",
      "content": "DOJ-OGR-00007651",
      "position": "footer"
    }
  ],
  "entities": {
    "people": [
      "Park Dietz"
    ],
    "organizations": [],
    "locations": [
      "Rye"
    ],
    "dates": [
      "11/23/21",
      "2005",
      "2004",
      "2003",
      "2002"
    ],
    "reference_numbers": [
      "1:20-cr-00330-PAE",
      "499-1",
      "DOJ-OGR-00007651"
    ]
  },
  "additional_notes": "The document appears to be a court filing with a list of episode titles and air dates from a TV show, likely related to a case involving Park Dietz, M.D., M.P.H., Ph.D."
}