{
  "document_metadata": {
    "page_number": "55",
    "document_number": "439",
    "date": "11/12/21",
    "document_type": "court document",
    "has_handwriting": false,
    "has_stamps": false
  },
  "full_text": "Case 1:20-cr-00330-PAE Document 439 Filed 11/12/21 Page 55 of 69\nsolely on the age of the participant, the generic federal definition of minor requires that the age of the alleged victim be the then-current age of consent in the jurisdiction where the sexual activity was intended or did occur.\nWhere the ability or incapacity to consent to sexual activity is age-dependent, the proof must satisfy the elements governed by the statute in effect at time and place where the alleged sexual activity may occur. For each count in the Indictment, age is a predicate element which the government must prove to bar the defense of consent. Counts Two and Four specify violations of New York State Penal Law ยง 130.55, which criminalizes sexual contact with a person less than 17 years old.33 For Count Two, the government must prove that Ms. Maxwell knew that was less than 17 years old.34 For Count Four, the government must prove that was less than 17 years old during purported sexual activity.35 For Count Six, the government must prove that Ms. Maxwell knew that was under age 18.36\nCounts One and Three charged conspiracies alleging conduct involving all four accusers identified in the Indictment and multi-jurisdictional locations with varying local state laws.\nDepending on the age of the accusers during the time frame of the conspiracy, consent may be an\n33 Section 130.55 - Sexual Abuse in the Third Degree - states in pertinent part:\nA person is guilty of sexual abuse in the third degree when her or she subjects another person to sexual contact without the latter's consent, except that in any prosecution under this section, it is an affirmative defense that (a) such other person's lack of consent was due solely to incapacity by reason of being less that seventeen years old.\nDesignated a B misdemeanor, the maximum penalty is \"shall not exceed three months,\" (ยง70.15(2)), far less than the16 months Maxwell has served in pretrial detention.\n34 See Government Proposed Request to Charge.\n35 See Government Proposed Request to Charge.\n36 See Government Proposed Request to Charge.\n47\nDOJ-OGR-00006472",
  "text_blocks": [
    {
      "type": "printed",
      "content": "Case 1:20-cr-00330-PAE Document 439 Filed 11/12/21 Page 55 of 69",
      "position": "header"
    },
    {
      "type": "printed",
      "content": "solely on the age of the participant, the generic federal definition of minor requires that the age of the alleged victim be the then-current age of consent in the jurisdiction where the sexual activity was intended or did occur.",
      "position": "top"
    },
    {
      "type": "printed",
      "content": "Where the ability or incapacity to consent to sexual activity is age-dependent, the proof must satisfy the elements governed by the statute in effect at time and place where the alleged sexual activity may occur. For each count in the Indictment, age is a predicate element which the government must prove to bar the defense of consent. Counts Two and Four specify violations of New York State Penal Law ยง 130.55, which criminalizes sexual contact with a person less than 17 years old.33 For Count Two, the government must prove that Ms. Maxwell knew that was less than 17 years old.34 For Count Four, the government must prove that was less than 17 years old during purported sexual activity.35 For Count Six, the government must prove that Ms. Maxwell knew that was under age 18.36",
      "position": "middle"
    },
    {
      "type": "printed",
      "content": "Counts One and Three charged conspiracies alleging conduct involving all four accusers identified in the Indictment and multi-jurisdictional locations with varying local state laws.",
      "position": "middle"
    },
    {
      "type": "printed",
      "content": "Depending on the age of the accusers during the time frame of the conspiracy, consent may be an",
      "position": "middle"
    },
    {
      "type": "printed",
      "content": "33 Section 130.55 - Sexual Abuse in the Third Degree - states in pertinent part:\nA person is guilty of sexual abuse in the third degree when her or she subjects another person to sexual contact without the latter's consent, except that in any prosecution under this section, it is an affirmative defense that (a) such other person's lack of consent was due solely to incapacity by reason of being less that seventeen years old.\nDesignated a B misdemeanor, the maximum penalty is \"shall not exceed three months,\" (ยง70.15(2)), far less than the16 months Maxwell has served in pretrial detention.",
      "position": "middle"
    },
    {
      "type": "printed",
      "content": "34 See Government Proposed Request to Charge.\n35 See Government Proposed Request to Charge.\n36 See Government Proposed Request to Charge.",
      "position": "bottom"
    },
    {
      "type": "printed",
      "content": "47",
      "position": "footer"
    },
    {
      "type": "printed",
      "content": "DOJ-OGR-00006472",
      "position": "footer"
    }
  ],
  "entities": {
    "people": [
      "Ms. Maxwell"
    ],
    "organizations": [
      "DOJ"
    ],
    "locations": [
      "New York"
    ],
    "dates": [
      "11/12/21"
    ],
    "reference_numbers": [
      "1:20-cr-00330-PAE",
      "439",
      "130.55",
      "70.15(2)",
      "DOJ-OGR-00006472"
    ]
  },
  "additional_notes": "The document appears to be a court filing related to the case against Ms. Maxwell. The text is mostly printed, with some redacted sections. The document includes references to specific laws and court documents."
}