{
  "document_metadata": {
    "page_number": "42 of 45",
    "document_number": "452-2",
    "date": "11/12/21",
    "document_type": "court document",
    "has_handwriting": false,
    "has_stamps": false
  },
  "full_text": "Case 1:20-cr-00330-PAE Document 452-2 Filed 11/12/21 Page 42 of 45\nIva A. E. Bicanic et al.\nTable 3. Demographic and (post-)rape characteristics by disclosure time (early vs. delayed disclosers) and odds ratios for delayed disclosure\n\nDemographic and (post-)rape characteristics\tEarly disclosure (N = 185)\tDelayed disclosure (i.e., > 1-week post-rape), N = 131\t\t\t\nN\t%\tN\t%\tOR\t95% CI\nAge category (years)\t\t\t\t\t\t\n18 25\t55\t17.4\t22\t7.0\t\t\n12 17\t130\t41.1\t109\t34.5\t2.10\t1.20 3.65*\nDutch origin\t\t\t\t\t\t\nNo\t27\t8.5\t22\t7.0\t\t\nYes\t158\t50.0\t109\t34.5\t0.85\t0.46 1.56\nLiving with parent(s)\t\t\t\t\t\t\nNo\t29\t9.2\t16\t5.1\t\t\nYes\t155\t49.2\t115\t36.5\t1.35\t0.70 2.59\nComplete family structure\t\t\t\t\t\t\nNo\t58\t18.4\t42\t13.3\t\t\nYes\t127\t40.3\t88\t27.9\t0.96\t0.59 1.55\nCurrent sexual relationship\t\t\t\t\t\t\nNo\t127\t41.8\t97\t31.9\t\t\nYes\t53\t17.4\t27\t8.9\t0.67\t0.39 1.14\nPrior negative sexual experience(s)\t\t\t\t\t\t\nNo\t152\t49.4\t110\t35.7\t\t\nYes\t32\t10.4\t14\t4.5\t0.61\t0.31 1.19\nKnown assailant\t\t\t\t\t\t\nNo\t56\t17.7\t36\t11.4\t\t\nYes\t129\t40.8\t95\t30.1\t1.15\t0.70 1.88\nClose to assailant\t\t\t\t\t\t\nNo\t150\t47.6\t84\t26.7\t\t\nYes\t35\t11.1\t46\t14.6\t2.35\t1.40 3.93*\nGroup rape\t\t\t\t\t\t\nNo\t160\t50.8\t116\t36.8\t\t\nYes\t24\t7.6\t15\t4.8\t0.86\t0.43 1.71\nAge of assailant (years)\t\t\t\t\t\t\n12 17\t63\t20.6\t54\t17.6\t\t\n> 18\t117\t38.2\t72\t23.5\t0.72\t0.45 1.14\nUse of penetration\t\t\t\t\t\t\nNo\t46\t14.7\t19\t6.1\t\t\nYes\t136\t43.5\t112\t35.8\t1.99\t1.10 3.60*\nUse of threats\t\t\t\t\t\t\nNo\t90\t31.6\t48\t16.8\t\t\nYes\t76\t26.7\t71\t24.9\t1.75\t1.09 2.82*\nUse of physical violence\t\t\t\t\t\t\nNo\t130\t42.6\t82\t26.9\t\t\nYes\t51\t16.7\t42\t13.8\t1.31\t0.80 2.14\nVictim's alcohol use\t\t\t\t\t\t\nNo\t72\t33.5\t69\t32.1\t\t\nYes\t61\t28.4\t13\t6.0\t0.22\t0.11 0.44*\n*p < 0.05.\nSeven participants were dropped from analyses due to missing disclosure time data.\nmember, or mentor. This finding is consistent with previous studies showing that the closer the relationship between the victim and assailant, the less likely the young woman was to report this victimization to anyone (Koss, 1988; Rickert et al., 2005; Wolitzky-Taylor et al., 2011). The dynamics of intrafamilial abuse is often proposed as\n6\n(page number not for citation purpose)\nCitation: European Journal of Psychotraumatology 2015, 6: 25883 http://dx.doi.org/10.3402/ejpt.v6.25883\nDOJ-OGR-00006877",
  "text_blocks": [
    {
      "type": "printed",
      "content": "Case 1:20-cr-00330-PAE Document 452-2 Filed 11/12/21 Page 42 of 45",
      "position": "header"
    },
    {
      "type": "printed",
      "content": "Iva A. E. Bicanic et al.",
      "position": "header"
    },
    {
      "type": "printed",
      "content": "Table 3. Demographic and (post-)rape characteristics by disclosure time (early vs. delayed disclosers) and odds ratios for delayed disclosure",
      "position": "header"
    },
    {
      "type": "printed",
      "content": "Demographic and (post-)rape characteristics\tEarly disclosure (N = 185)\tDelayed disclosure (i.e., > 1-week post-rape), N = 131\t\t\t\nN\t%\tN\t%\tOR\t95% CI\nAge category (years)\t\t\t\t\t\t\n18 25\t55\t17.4\t22\t7.0\t\t\n12 17\t130\t41.1\t109\t34.5\t2.10\t1.20 3.65*\nDutch origin\t\t\t\t\t\t\nNo\t27\t8.5\t22\t7.0\t\t\nYes\t158\t50.0\t109\t34.5\t0.85\t0.46 1.56\nLiving with parent(s)\t\t\t\t\t\t\nNo\t29\t9.2\t16\t5.1\t\t\nYes\t155\t49.2\t115\t36.5\t1.35\t0.70 2.59\nComplete family structure\t\t\t\t\t\t\nNo\t58\t18.4\t42\t13.3\t\t\nYes\t127\t40.3\t88\t27.9\t0.96\t0.59 1.55\nCurrent sexual relationship\t\t\t\t\t\t\nNo\t127\t41.8\t97\t31.9\t\t\nYes\t53\t17.4\t27\t8.9\t0.67\t0.39 1.14\nPrior negative sexual experience(s)\t\t\t\t\t\t\nNo\t152\t49.4\t110\t35.7\t\t\nYes\t32\t10.4\t14\t4.5\t0.61\t0.31 1.19\nKnown assailant\t\t\t\t\t\t\nNo\t56\t17.7\t36\t11.4\t\t\nYes\t129\t40.8\t95\t30.1\t1.15\t0.70 1.88\nClose to assailant\t\t\t\t\t\t\nNo\t150\t47.6\t84\t26.7\t\t\nYes\t35\t11.1\t46\t14.6\t2.35\t1.40 3.93*\nGroup rape\t\t\t\t\t\t\nNo\t160\t50.8\t116\t36.8\t\t\nYes\t24\t7.6\t15\t4.8\t0.86\t0.43 1.71\nAge of assailant (years)\t\t\t\t\t\t\n12 17\t63\t20.6\t54\t17.6\t\t\n> 18\t117\t38.2\t72\t23.5\t0.72\t0.45 1.14\nUse of penetration\t\t\t\t\t\t\nNo\t46\t14.7\t19\t6.1\t\t\nYes\t136\t43.5\t112\t35.8\t1.99\t1.10 3.60*\nUse of threats\t\t\t\t\t\t\nNo\t90\t31.6\t48\t16.8\t\t\nYes\t76\t26.7\t71\t24.9\t1.75\t1.09 2.82*\nUse of physical violence\t\t\t\t\t\t\nNo\t130\t42.6\t82\t26.9\t\t\nYes\t51\t16.7\t42\t13.8\t1.31\t0.80 2.14\nVictim's alcohol use\t\t\t\t\t\t\nNo\t72\t33.5\t69\t32.1\t\t\nYes\t61\t28.4\t13\t6.0\t0.22\t0.11 0.44*\n*p < 0.05.",
      "position": "main content"
    },
    {
      "type": "printed",
      "content": "Seven participants were dropped from analyses due to missing disclosure time data.",
      "position": "main content"
    },
    {
      "type": "printed",
      "content": "member, or mentor. This finding is consistent with previous studies showing that the closer the relationship between the victim and assailant, the less likely the young woman was to report this victimization to anyone (Koss, 1988; Rickert et al., 2005; Wolitzky-Taylor et al., 2011). The dynamics of intrafamilial abuse is often proposed as",
      "position": "main content"
    },
    {
      "type": "printed",
      "content": "6",
      "position": "footer"
    },
    {
      "type": "printed",
      "content": "(page number not for citation purpose)",
      "position": "footer"
    },
    {
      "type": "printed",
      "content": "Citation: European Journal of Psychotraumatology 2015, 6: 25883 http://dx.doi.org/10.3402/ejpt.v6.25883",
      "position": "footer"
    },
    {
      "type": "printed",
      "content": "DOJ-OGR-00006877",
      "position": "footer"
    }
  ],
  "entities": {
    "people": [
      "Iva A. E. Bicanic",
      "Koss",
      "Rickert",
      "Wolitzky-Taylor"
    ],
    "organizations": [
      "European Journal of Psychotraumatology"
    ],
    "locations": [],
    "dates": [
      "11/12/21",
      "1988",
      "2005",
      "2011",
      "2015"
    ],
    "reference_numbers": [
      "1:20-cr-00330-PAE",
      "452-2",
      "25883",
      "DOJ-OGR-00006877"
    ]
  },
  "additional_notes": "The document appears to be a court document related to a case involving rape and disclosure. The table presents demographic and post-rape characteristics by disclosure time. The document includes citations and references to previous studies."
}