{
  "document_metadata": {
    "page_number": "326",
    "document_number": "499-1",
    "date": "11/23/21",
    "document_type": "court document",
    "has_handwriting": false,
    "has_stamps": false
  },
  "full_text": "Case 1:20-cr-00330-PAE Document 499-1 Filed 11/23/21 Page 326 of 375\nThe Governor's Misguided Attempt to Change the Exclusionary Rule, New York Law Journal, p. 2 (February 5, 1996)\nJudicial \"Conservatism\", New York Law Journal, p. 2 (June 21, 1995)\nFederal-State Debate Put in Perspective, The Reporter Dispatch (February 2, 1995)\nProsecutorial Misconduct in Presenting Evidence - Backdooring Hearsay, 31 Criminal Law Bulletin 99 (1995)\nForfeiture and the Constitution, New York Law Journal, p. 1 (January 11, 1994)\nSecond Circuit Evidentiary Ruling Includes Caution to Prosecutors, New York Law Journal, p. 1 (April 1, 1994)\nAbuse of Power in the Prosecutor's Office, 6 The World and I 476 (1991) [reprinted in Criminal Justice, Annual Editions (1992-93)]\nThemes of Injustice: Wrongful Convictions, Racial Prejudice, and Lawyer Incompetence, 29 Criminal Law Bulletin 502 (1993) [reprinted in L. Stolzenberg & S. D'Alessio, Criminal Courts for the 21st Century, p. 354 (1998)]\nDefending the Poor, Trial, p. 47 (March, 1993)\nUpdate on Rape Law in New York, New York Law Journal, p.1 (June 9, 1993)\nReforming New York Criminal Discovery, New York Law Journal, p. 1 (January 27, 1993)\nTricks Prosecutors Play, Trial, p. 46 (April, 1992)\nWill the Real Jim Garrison Please Stand Up?, New York Law Journal, p. 2 (January 27, 1993)\nEntrapment Revisited, New York Law Journal, p. 1 (January 27, 1993)\nSupervising Prosecutorial Misconduct in Grand Juries, New York Law Journal, p. 1 (August 3, 1992)\nDisqualifying Judges for Bias: The Sarokin Case, New York Law Journal, p. 1 (September 21, 1992)\nJustice Must Temper Zeal in Death Cases, The Reporter Dispatch (May 24, 1992)\n6\nDOJ-OGR-00007819",
  "text_blocks": [
    {
      "type": "printed",
      "content": "Case 1:20-cr-00330-PAE Document 499-1 Filed 11/23/21 Page 326 of 375",
      "position": "header"
    },
    {
      "type": "printed",
      "content": "The Governor's Misguided Attempt to Change the Exclusionary Rule, New York Law Journal, p. 2 (February 5, 1996)\nJudicial \"Conservatism\", New York Law Journal, p. 2 (June 21, 1995)\nFederal-State Debate Put in Perspective, The Reporter Dispatch (February 2, 1995)\nProsecutorial Misconduct in Presenting Evidence - Backdooring Hearsay, 31 Criminal Law Bulletin 99 (1995)\nForfeiture and the Constitution, New York Law Journal, p. 1 (January 11, 1994)\nSecond Circuit Evidentiary Ruling Includes Caution to Prosecutors, New York Law Journal, p. 1 (April 1, 1994)\nAbuse of Power in the Prosecutor's Office, 6 The World and I 476 (1991) [reprinted in Criminal Justice, Annual Editions (1992-93)]\nThemes of Injustice: Wrongful Convictions, Racial Prejudice, and Lawyer Incompetence, 29 Criminal Law Bulletin 502 (1993) [reprinted in L. Stolzenberg & S. D'Alessio, Criminal Courts for the 21st Century, p. 354 (1998)]\nDefending the Poor, Trial, p. 47 (March, 1993)\nUpdate on Rape Law in New York, New York Law Journal, p.1 (June 9, 1993)\nReforming New York Criminal Discovery, New York Law Journal, p. 1 (January 27, 1993)\nTricks Prosecutors Play, Trial, p. 46 (April, 1992)\nWill the Real Jim Garrison Please Stand Up?, New York Law Journal, p. 2 (January 27, 1993)\nEntrapment Revisited, New York Law Journal, p. 1 (January 27, 1993)\nSupervising Prosecutorial Misconduct in Grand Juries, New York Law Journal, p. 1 (August 3, 1992)\nDisqualifying Judges for Bias: The Sarokin Case, New York Law Journal, p. 1 (September 21, 1992)\nJustice Must Temper Zeal in Death Cases, The Reporter Dispatch (May 24, 1992)",
      "position": "main body"
    },
    {
      "type": "printed",
      "content": "6",
      "position": "footer"
    },
    {
      "type": "printed",
      "content": "DOJ-OGR-00007819",
      "position": "footer"
    }
  ],
  "entities": {
    "people": [
      "Jim Garrison",
      "L. Stolzenberg",
      "S. D'Alessio",
      "Sarokin"
    ],
    "organizations": [
      "New York Law Journal",
      "The Reporter Dispatch",
      "Criminal Law Bulletin",
      "The World and I"
    ],
    "locations": [
      "New York"
    ],
    "dates": [
      "February 5, 1996",
      "June 21, 1995",
      "February 2, 1995",
      "1995",
      "January 11, 1994",
      "April 1, 1994",
      "1991",
      "1992",
      "1993",
      "1998",
      "March, 1993",
      "June 9, 1993",
      "January 27, 1993",
      "April, 1992",
      "January 27, 1993",
      "August 3, 1992",
      "September 21, 1992",
      "May 24, 1992",
      "11/23/21"
    ],
    "reference_numbers": [
      "1:20-cr-00330-PAE",
      "499-1",
      "DOJ-OGR-00007819"
    ]
  },
  "additional_notes": "The document appears to be a court filing with a list of references related to legal topics. The text is clear and legible, with no visible redactions or damage."
}