{
  "document_metadata": {
    "page_number": "5",
    "document_number": "367",
    "date": "10/22/21",
    "document_type": "Juror Questionnaire",
    "has_handwriting": false,
    "has_stamps": false
  },
  "full_text": "Case 1:20-cr-00330-PAE Document 367 Filed 10/22/21 Page 5 of 35 Juror ID: Do (did) you supervise other people? Yes No Please briefly describe what your management and/or supervisory responsibilities have entailed: If you have held any other occupations in the past five years, please identify them here: What is the highest level of education you have completed? Less than high school High school graduate Some college/vocational training College graduate. If so, please indicate degree and/or field of study: Post-graduate degree. If so, please indicate degree and/or field of study: Please list all educational institutions you have attended, beginning with high school: Please complete the following questions regarding your present spouse or domestic partner/significant other. If you are divorced, widowed, or separated, please answer the following questions regarding your former spouse, partner or significant other's employment: What is his or her current employment status? Employed full-time Employed part-time Self-employed Homemaker Unemployed/laid-off Disabled Retired Full-time student (please state area of study) Other (please describe) What is his or her occupation (or what was it, if he or she is no longer employed)? By whom is (was) he or she employed? -5- DOJ-OGR-00005327",
  "text_blocks": [
    {
      "type": "printed",
      "content": "Case 1:20-cr-00330-PAE Document 367 Filed 10/22/21 Page 5 of 35",
      "position": "header"
    },
    {
      "type": "printed",
      "content": "Juror ID:",
      "position": "top"
    },
    {
      "type": "printed",
      "content": "Do (did) you supervise other people? Yes No Please briefly describe what your management and/or supervisory responsibilities have entailed:",
      "position": "top"
    },
    {
      "type": "printed",
      "content": "If you have held any other occupations in the past five years, please identify them here:",
      "position": "top"
    },
    {
      "type": "printed",
      "content": "What is the highest level of education you have completed? Less than high school High school graduate Some college/vocational training College graduate. If so, please indicate degree and/or field of study: Post-graduate degree. If so, please indicate degree and/or field of study: Please list all educational institutions you have attended, beginning with high school:",
      "position": "middle"
    },
    {
      "type": "printed",
      "content": "Please complete the following questions regarding your present spouse or domestic partner/significant other. If you are divorced, widowed, or separated, please answer the following questions regarding your former spouse, partner or significant other's employment: What is his or her current employment status? Employed full-time Employed part-time Self-employed Homemaker Unemployed/laid-off Disabled Retired Full-time student (please state area of study) Other (please describe)",
      "position": "middle"
    },
    {
      "type": "printed",
      "content": "What is his or her occupation (or what was it, if he or she is no longer employed)? By whom is (was) he or she employed?",
      "position": "middle"
    },
    {
      "type": "printed",
      "content": "-5-",
      "position": "footer"
    },
    {
      "type": "printed",
      "content": "DOJ-OGR-00005327",
      "position": "footer"
    }
  ],
  "entities": {
    "people": [],
    "organizations": [],
    "locations": [],
    "dates": [
      "10/22/21"
    ],
    "reference_numbers": [
      "1:20-cr-00330-PAE",
      "367",
      "DOJ-OGR-00005327"
    ]
  },
  "additional_notes": "The document appears to be a juror questionnaire from a court case. It contains various questions about the juror's background, education, and employment status, as well as that of their spouse or significant other. The document is page 5 of 35 and has a header with case information and a footer with a page number and a reference number."
}