{
  "document_metadata": {
    "page_number": "2",
    "document_number": "219",
    "date": "04/19/21",
    "document_type": "court document",
    "has_handwriting": false,
    "has_stamps": false
  },
  "full_text": "Case 1:20-cr-00330-PAE Document 219 Filed 04/19/21 Page 2 of 2\nPage 2\nThe Government appreciates the need to resolve this scheduling matter quickly. However, with the goal of being able to most accurately address the Court's question, the Government respectfully requests that the Court grant the Government until Thursday, April 22, 2021 to submit its response.\nRespectfully submitted,\nAUDREY STRAUSS\nUnited States Attorney\nBy: /s\nAlison Moe / Maurene Comey\nLara Pomerantz / Andrew Rohrbach\nAssistant United States Attorneys\nSouthern District of New York\nTel: (212) 637-2225\nCc: All Counsel of Record (By ECF)\nDOJ-OGR-00003862",
  "text_blocks": [
    {
      "type": "printed",
      "content": "Case 1:20-cr-00330-PAE Document 219 Filed 04/19/21 Page 2 of 2",
      "position": "header"
    },
    {
      "type": "printed",
      "content": "Page 2",
      "position": "top"
    },
    {
      "type": "printed",
      "content": "The Government appreciates the need to resolve this scheduling matter quickly. However, with the goal of being able to most accurately address the Court's question, the Government respectfully requests that the Court grant the Government until Thursday, April 22, 2021 to submit its response.",
      "position": "middle"
    },
    {
      "type": "printed",
      "content": "Respectfully submitted,\nAUDREY STRAUSS\nUnited States Attorney\nBy: /s\nAlison Moe / Maurene Comey\nLara Pomerantz / Andrew Rohrbach\nAssistant United States Attorneys\nSouthern District of New York\nTel: (212) 637-2225",
      "position": "middle"
    },
    {
      "type": "printed",
      "content": "Cc: All Counsel of Record (By ECF)",
      "position": "middle"
    },
    {
      "type": "printed",
      "content": "DOJ-OGR-00003862",
      "position": "footer"
    }
  ],
  "entities": {
    "people": [
      "Audrey Strauss",
      "Alison Moe",
      "Maurene Comey",
      "Lara Pomerantz",
      "Andrew Rohrbach"
    ],
    "organizations": [
      "United States Attorney",
      "Southern District of New York"
    ],
    "locations": [
      "New York"
    ],
    "dates": [
      "04/19/21",
      "April 22, 2021"
    ],
    "reference_numbers": [
      "1:20-cr-00330-PAE",
      "219",
      "DOJ-OGR-00003862"
    ]
  },
  "additional_notes": "The document appears to be a court filing with a clear and legible format. There are no visible redactions or damage."
}