{
  "document_metadata": {
    "page_number": "1",
    "document_number": "328",
    "date": "08/25/21",
    "document_type": "Letter",
    "has_handwriting": false,
    "has_stamps": false
  },
  "full_text": "Case 1:20-cr-00330-PAE Document 328 Filed 08/25/21 Page 1 of 1 COHEN & GRESSER LLP 800 Third Avenue New York, NY 10022 +1 212 957 7600 phone www.cohengresser.com Christian R. Everdell +1 (212) 957-7600 ceverdell@cohengresser.com August 25, 2021 BY ECF The Honorable Alison J. Nathan United States District Court Southern District of New York United States Courthouse 40 Foley Square New York, NY 10007 Re: United States v. Ghislaine Maxwell, S2 20 Cr. 330 (AJN) Dear Judge Nathan: Pursuant to the Court's Order, dated August 23, 2021 (Dkt. 325), we write to advise the Court that defense counsel provided copies of the Court's August 23rd Order and its August 13th temporarily sealed Opinion and Order to the intended recipients of the subpoenas or their counsel via email on August 24, 2021 and August 25, 2021. Sincerely, /s/ Christian Everdell Christian R. Everdell COHEN & GRESSER LLP 800 Third Avenue, 21st Floor New York, New York 10022 (212) 957-7600 cc: All Counsel of Record (By ECF) DOJ-OGR-00005015",
  "text_blocks": [
    {
      "type": "printed",
      "content": "Case 1:20-cr-00330-PAE Document 328 Filed 08/25/21 Page 1 of 1",
      "position": "header"
    },
    {
      "type": "printed",
      "content": "COHEN & GRESSER LLP 800 Third Avenue New York, NY 10022 +1 212 957 7600 phone www.cohengresser.com",
      "position": "header"
    },
    {
      "type": "printed",
      "content": "Christian R. Everdell +1 (212) 957-7600 ceverdell@cohengresser.com",
      "position": "header"
    },
    {
      "type": "printed",
      "content": "August 25, 2021",
      "position": "top"
    },
    {
      "type": "printed",
      "content": "BY ECF The Honorable Alison J. Nathan United States District Court Southern District of New York United States Courthouse 40 Foley Square New York, NY 10007",
      "position": "middle"
    },
    {
      "type": "printed",
      "content": "Re: United States v. Ghislaine Maxwell, S2 20 Cr. 330 (AJN)",
      "position": "middle"
    },
    {
      "type": "printed",
      "content": "Dear Judge Nathan: Pursuant to the Court's Order, dated August 23, 2021 (Dkt. 325), we write to advise the Court that defense counsel provided copies of the Court's August 23rd Order and its August 13th temporarily sealed Opinion and Order to the intended recipients of the subpoenas or their counsel via email on August 24, 2021 and August 25, 2021.",
      "position": "middle"
    },
    {
      "type": "printed",
      "content": "Sincerely, /s/ Christian Everdell Christian R. Everdell COHEN & GRESSER LLP 800 Third Avenue, 21st Floor New York, New York 10022 (212) 957-7600",
      "position": "middle"
    },
    {
      "type": "printed",
      "content": "cc: All Counsel of Record (By ECF)",
      "position": "bottom"
    },
    {
      "type": "printed",
      "content": "DOJ-OGR-00005015",
      "position": "footer"
    }
  ],
  "entities": {
    "people": [
      "Christian R. Everdell",
      "Alison J. Nathan",
      "Ghislaine Maxwell"
    ],
    "organizations": [
      "COHEN & GRESSER LLP",
      "United States District Court",
      "Southern District of New York"
    ],
    "locations": [
      "New York",
      "NY",
      "United States"
    ],
    "dates": [
      "August 25, 2021",
      "August 23, 2021",
      "August 24, 2021",
      "August 13, 2021"
    ],
    "reference_numbers": [
      "1:20-cr-00330-PAE",
      "Document 328",
      "S2 20 Cr. 330 (AJN)",
      "Dkt. 325",
      "DOJ-OGR-00005015"
    ]
  },
  "additional_notes": "The document is a letter from Christian R. Everdell to Judge Alison J. Nathan regarding the case United States v. Ghislaine Maxwell. The letter is dated August 25, 2021, and is filed electronically via ECF."
}