{
  "document_metadata": {
    "page_number": "209",
    "document_number": "749",
    "date": "08/10/22",
    "document_type": "court transcript",
    "has_handwriting": false,
    "has_stamps": false
  },
  "full_text": "Case 1:20-cr-00330-PAE Document 749 Filed 08/10/22 Page 209 of 236 LC3Cmax7 Parkinson - cross 1113 believe the exhibit is on Mr. Parkinson's screen, so he can look at it there and the government has their own copy. Apologies. BY MR. EVERDELL: Q. Mr. Parkinson, if you could look at what's already in evidence under seal as Government Exhibit 234. A. Yes. Q. That is the area around Mr. Epstein's desk; isn't that right? A. True. Q. And you see there are a number of photos on his desk? A. True. Q. And there are a number of photos that are on the bookcase shelves behind the desk? A. True. MR. EVERDELL: Now, I also want to show just for the witness, the Court, and the Court's deputy what is already in evidence but under seal as Government Exhibit 245. THE COURT: Okay. Would you like the jurors -- MR. EVERDELL: I would like the jurors to look, too, yes, your Honor. THE COURT: You can take out your binders and look at Government Exhibit 245. MR. EVERDELL: We'll just wait a minute for the jurors to open their binders. I think the jurors have the binders SOUTHERN DISTRICT REPORTERS, P.C. (212) 805-0300 DOJ-OGR-00018310",
  "text_blocks": [
    {
      "type": "printed",
      "content": "Case 1:20-cr-00330-PAE Document 749 Filed 08/10/22 Page 209 of 236",
      "position": "header"
    },
    {
      "type": "printed",
      "content": "LC3Cmax7 Parkinson - cross 1113",
      "position": "header"
    },
    {
      "type": "printed",
      "content": "believe the exhibit is on Mr. Parkinson's screen, so he can look at it there and the government has their own copy. Apologies. BY MR. EVERDELL: Q. Mr. Parkinson, if you could look at what's already in evidence under seal as Government Exhibit 234. A. Yes. Q. That is the area around Mr. Epstein's desk; isn't that right? A. True. Q. And you see there are a number of photos on his desk? A. True. Q. And there are a number of photos that are on the bookcase shelves behind the desk? A. True. MR. EVERDELL: Now, I also want to show just for the witness, the Court, and the Court's deputy what is already in evidence but under seal as Government Exhibit 245. THE COURT: Okay. Would you like the jurors -- MR. EVERDELL: I would like the jurors to look, too, yes, your Honor. THE COURT: You can take out your binders and look at Government Exhibit 245. MR. EVERDELL: We'll just wait a minute for the jurors to open their binders. I think the jurors have the binders",
      "position": "main"
    },
    {
      "type": "printed",
      "content": "SOUTHERN DISTRICT REPORTERS, P.C. (212) 805-0300",
      "position": "footer"
    },
    {
      "type": "printed",
      "content": "DOJ-OGR-00018310",
      "position": "footer"
    }
  ],
  "entities": {
    "people": [
      "Mr. Parkinson",
      "Mr. Everdell",
      "Mr. Epstein"
    ],
    "organizations": [
      "SOUTHERN DISTRICT REPORTERS, P.C."
    ],
    "locations": [],
    "dates": [
      "08/10/22"
    ],
    "reference_numbers": [
      "1:20-cr-00330-PAE",
      "749",
      "234",
      "245",
      "DOJ-OGR-00018310"
    ]
  },
  "additional_notes": "The document appears to be a court transcript with a clear and legible format. There are no visible redactions or damage."
}