{
  "document_metadata": {
    "page_number": "20",
    "document_number": "20-cr-00330",
    "date": "09/24/2020",
    "document_type": "Court Document",
    "has_handwriting": false,
    "has_stamps": false
  },
  "full_text": "Case 1:20-cr-00330-AJN Document 17 Filed 09/08/20 Page 20 of 125\n\naided and abetted the same, to wit, MAXWELL arranged for Minor Victim-1 to be transported from Florida to New York, New York on multiple occasions with the intention that Minor Victim-1 would engage in one or more sex acts with Jeffrey Epstein, in violation of New York Penal Law, Section 130.55.\n\n(Title 18, United States Code, Sections 2423(a) and 2.)\n\nCOUNT FIVE\n(Perjury)\n\nThe Grand Jury further charges:\n\n20. The allegations contained in paragraphs 1 through 8 of this Indictment are repeated and realleged as if fully set forth within.\n\n21. On or about April 22, 2016, in the Southern District of New York, GHISLAINE MAXWELL, the defendant, having taken an oath to testify truthfully in a deposition in connection with a case then pending before the United States District Court for the Southern District of New York under docket number 15 Civ. 7433, knowingly made false material declarations, to wit, MAXWELL gave the following underlined false testimony:\n\nQ. Did Jeffrey Epstein have a scheme to recruit underage girls for sexual massages? If you know.\n\nA. I don't know what you're talking about.\n\n...\n\n15\nApp.027\nDOJ-OGR-00019486",
  "text_blocks": [
    {
      "type": "printed",
      "content": "Case 1:20-cr-00330-AJN Document 17 Filed 09/08/20 Page 20 of 125",
      "position": "header"
    },
    {
      "type": "printed",
      "content": "aided and abetted the same, to wit, MAXWELL arranged for Minor Victim-1 to be transported from Florida to New York, New York on multiple occasions with the intention that Minor Victim-1 would engage in one or more sex acts with Jeffrey Epstein, in violation of New York Penal Law, Section 130.55.\n\n(Title 18, United States Code, Sections 2423(a) and 2.)\n\nCOUNT FIVE\n(Perjury)\n\nThe Grand Jury further charges:\n\n20. The allegations contained in paragraphs 1 through 8 of this Indictment are repeated and realleged as if fully set forth within.\n\n21. On or about April 22, 2016, in the Southern District of New York, GHISLAINE MAXWELL, the defendant, having taken an oath to testify truthfully in a deposition in connection with a case then pending before the United States District Court for the Southern District of New York under docket number 15 Civ. 7433, knowingly made false material declarations, to wit, MAXWELL gave the following underlined false testimony:\n\nQ. Did Jeffrey Epstein have a scheme to recruit underage girls for sexual massages? If you know.\n\nA. I don't know what you're talking about.",
      "position": "main"
    },
    {
      "type": "printed",
      "content": "15",
      "position": "footer"
    },
    {
      "type": "printed",
      "content": "App.027",
      "position": "footer"
    },
    {
      "type": "printed",
      "content": "DOJ-OGR-00019486",
      "position": "footer"
    }
  ],
  "entities": {
    "people": [
      "MAXWELL",
      "Jeffrey Epstein",
      "GHISLAINE MAXWELL",
      "Minor Victim-1"
    ],
    "organizations": [
      "United States District Court",
      "Grand Jury"
    ],
    "locations": [
      "Florida",
      "New York",
      "Southern District of New York"
    ],
    "dates": [
      "April 22, 2016",
      "09/08/20",
      "09/24/2020"
    ],
    "reference_numbers": [
      "20-cr-00330",
      "15 Civ. 7433",
      "DOJ-OGR-00019486"
    ]
  },
  "additional_notes": "The document appears to be a court filing related to the case against Ghislaine Maxwell. It includes details about the charges and specific allegations. The text is mostly printed, with no visible handwriting or stamps. The document is well-formatted and legible."
}