{
  "document_metadata": {
    "page_number": "116",
    "document_number": "753",
    "date": "08/10/22",
    "document_type": "court transcript",
    "has_handwriting": false,
    "has_stamps": false
  },
  "full_text": "Case 1:20-cr-00330-PAE Document 753 Filed 08/10/22 Page 116 of 264 1542 LC7VMAX3 Carolyn - direct knew that he had a home here in New York. Q. What was inside those packages? A. Lingerie from Victoria's Secrets. Q. How did Mr. Epstein get your address as far as you know? A. I had given -- MR. PAGLIUCA: Objection, your Honor. Lack of foundation. THE COURT: Sustained. Q. Did you give your address to anyone? A. Yes. Q. Who? A. Maxwell. Q. Why did you give your address to Maxwell? A. Because Jeffrey Epstein wanted to send me some items. I wasn't sure what the items were going to be. Q. And so did she ask for your address? A. Yes. Q. And did you give her your address? A. Yes. Q. Other than the lingerie, did you receive any other gifts? A. Yes. A massage book for dummies, because I wanted to be a massage therapist; and concert tickets to Incubus. Q. Other than Virginia, were there ever any other females in the room with you when you were massaging Jeffrey Epstein? A. Yes. SOUTHERN DISTRICT REPORTERS, P.C. (212) 805-0300 DOJ-OGR-00018714",
  "text_blocks": [
    {
      "type": "printed",
      "content": "Case 1:20-cr-00330-PAE Document 753 Filed 08/10/22 Page 116 of 264 1542",
      "position": "header"
    },
    {
      "type": "printed",
      "content": "LC7VMAX3 Carolyn - direct",
      "position": "header"
    },
    {
      "type": "printed",
      "content": "knew that he had a home here in New York. Q. What was inside those packages? A. Lingerie from Victoria's Secrets. Q. How did Mr. Epstein get your address as far as you know? A. I had given -- MR. PAGLIUCA: Objection, your Honor. Lack of foundation. THE COURT: Sustained. Q. Did you give your address to anyone? A. Yes. Q. Who? A. Maxwell. Q. Why did you give your address to Maxwell? A. Because Jeffrey Epstein wanted to send me some items. I wasn't sure what the items were going to be. Q. And so did she ask for your address? A. Yes. Q. And did you give her your address? A. Yes. Q. Other than the lingerie, did you receive any other gifts? A. Yes. A massage book for dummies, because I wanted to be a massage therapist; and concert tickets to Incubus. Q. Other than Virginia, were there ever any other females in the room with you when you were massaging Jeffrey Epstein? A. Yes.",
      "position": "main"
    },
    {
      "type": "printed",
      "content": "SOUTHERN DISTRICT REPORTERS, P.C. (212) 805-0300",
      "position": "footer"
    },
    {
      "type": "printed",
      "content": "DOJ-OGR-00018714",
      "position": "footer"
    }
  ],
  "entities": {
    "people": [
      "Jeffrey Epstein",
      "Maxwell",
      "Virginia",
      "Carolyn",
      "PAGLIUCA"
    ],
    "organizations": [
      "Victoria's Secrets",
      "Incubus",
      "SOUTHERN DISTRICT REPORTERS, P.C."
    ],
    "locations": [
      "New York"
    ],
    "dates": [
      "08/10/22"
    ],
    "reference_numbers": [
      "1:20-cr-00330-PAE",
      "753",
      "DOJ-OGR-00018714"
    ]
  },
  "additional_notes": "The document appears to be a court transcript with a clear and legible format. There are no visible redactions or damage."
}