{
  "document_metadata": {
    "page_number": "155",
    "document_number": "753",
    "date": "08/10/22",
    "document_type": "court transcript",
    "has_handwriting": false,
    "has_stamps": false
  },
  "full_text": "Case 1:20-cr-00330-PAE Document 753 Filed 08/10/22 Page 155 of 264 LC7VMAX5 Carolyn - cross 1 explored in your cross-examination, which is under oath. But I do think in advance of that, we need a full understanding which I think includes making sure you have every text and email communication. I would think you need to have an interview with Jane, as well, to see if you're getting the same information from her. And I think you need to make sure that there are no other conduits of information regarding Jane's testimony to the brother. MR. ROHRBACH: Yes, your Honor. THE COURT: Okay. And I've started to look at the law too. I think it's unlikely we're going to get to a breach of the text of the rule. I think my hypo about if somebody passed the transcript would certainly go to a violation of the spirit of the rule and not the text. And there may be some further version of full communication of her testimony, especially a witness who's being put on solely to provide prior consistent statements. I don't think the government did anything wrong. I'm a little shocked that this wasn't fully drilled into these witnesses just as a matter of best practice. I understand from the notes that it was communicated to the witnesses not to speak to other witnesses, but somehow this witness didn't understand that to mean his sister. But here we are. MR. ROHRBACH: Your Honor, on that point, we would just say that the notes from today reflect that the witness SOUTHERN DISTRICT REPORTERS, P.C. (212) 805-0300 DOJ-OGR-00018753",
  "text_blocks": [
    {
      "type": "printed",
      "content": "Case 1:20-cr-00330-PAE Document 753 Filed 08/10/22 Page 155 of 264",
      "position": "header"
    },
    {
      "type": "handwritten",
      "content": "LC7VMAX5 Carolyn - cross",
      "position": "header"
    },
    {
      "type": "printed",
      "content": "1 explored in your cross-examination, which is under oath. But I do think in advance of that, we need a full understanding which I think includes making sure you have every text and email communication. I would think you need to have an interview with Jane, as well, to see if you're getting the same information from her. And I think you need to make sure that there are no other conduits of information regarding Jane's testimony to the brother. MR. ROHRBACH: Yes, your Honor. THE COURT: Okay. And I've started to look at the law too. I think it's unlikely we're going to get to a breach of the text of the rule. I think my hypo about if somebody passed the transcript would certainly go to a violation of the spirit of the rule and not the text. And there may be some further version of full communication of her testimony, especially a witness who's being put on solely to provide prior consistent statements. I don't think the government did anything wrong. I'm a little shocked that this wasn't fully drilled into these witnesses just as a matter of best practice. I understand from the notes that it was communicated to the witnesses not to speak to other witnesses, but somehow this witness didn't understand that to mean his sister. But here we are. MR. ROHRBACH: Your Honor, on that point, we would just say that the notes from today reflect that the witness",
      "position": "main content"
    },
    {
      "type": "printed",
      "content": "SOUTHERN DISTRICT REPORTERS, P.C. (212) 805-0300",
      "position": "footer"
    },
    {
      "type": "printed",
      "content": "DOJ-OGR-00018753",
      "position": "footer"
    }
  ],
  "entities": {
    "people": [
      "Jane",
      "MR. ROHRBACH"
    ],
    "organizations": [
      "SOUTHERN DISTRICT REPORTERS, P.C."
    ],
    "locations": [],
    "dates": [
      "08/10/22"
    ],
    "reference_numbers": [
      "1:20-cr-00330-PAE",
      "753",
      "DOJ-OGR-00018753"
    ]
  },
  "additional_notes": "The document appears to be a court transcript with a clear and readable format. There are no visible redactions or damage to the text."
}